"Updated : September 15, 2016, 11:34 am",Videocon Cube 3 smartphone to have new new panic button app
"Updated : September 15, 2016, 11:32 am","Meet Devendra Jhajharia, the two-time paralympic gold medallist"
"Updated : September 14, 2016, 10:21 pm",Ravindra Jadeja takes 10 as India Blue win Duleep Trophy
"Updated : September 14, 2016, 9:10 pm",Gambhir not in favour of Pink Ball Tests
"Updated : September 14, 2016, 8:35 pm",Gambhir not in favour of Pink Ball Tests
"Updated : September 14, 2016, 8:15 pm",Good for us that 3 openers are vying for 2 slots: Dhawan
"Updated : September 14, 2016, 7:40 pm",SPORT-DULEEP-COMMENTS 2 LAST
"Updated : September 14, 2016, 5:50 pm",OSSSC Junior Clerk Skill Test 2016: Admit card released at osssc.gov.in
"Updated : September 14, 2016, 5:50 pm","Peoples participation, feedback imp to make governance"
"Updated : September 14, 2016, 5:50 pm",Victims family to challenge Shahabuddins bail in SC tomorrow
"Updated : September 14, 2016, 5:50 pm",Kumar Urban raises Rs 300-cr from Altico Capital
"Updated : September 14, 2016, 5:50 pm",No position yet on accession of non-NPT country into NSG:China
"Updated : September 14, 2016, 5:40 pm",Nadal and Marc aim empty boxes with serve in practice
"Updated : September 14, 2016, 5:35 pm",Zero tolerance for height norm violations near airports: HC
"Updated : September 14, 2016, 5:35 pm",Lady Gaga in talks to play 2017 Super Bowl Halftime Show?
"Updated : September 14, 2016, 5:30 pm","Planned urbanisation key to economic growth, says Venkaiah"
"Updated : September 14, 2016, 5:29 pm","IIT Gandhinagar is hiring: Apply for 8 Deputy Engineer, other posts"
"Updated : September 14, 2016, 5:20 pm",Cameron blamed for rise of ISIS by UK MPs
"Updated : September 14, 2016, 5:20 pm",MARCONI 3
"Updated : September 14, 2016, 5:20 pm",FOOTPRINT 2
"Updated : September 14, 2016, 5:20 pm",FOOTPRINT 3 LAST
"Updated : September 14, 2016, 4:54 pm","Apart from Indian Idol, these 5 music TV shows MUST make a comeback!"
"Updated : September 14, 2016, 4:50 pm",HCHR-INDIA 2LAST
"Updated : September 14, 2016, 4:42 pm",Six mathematical equations that changed the world
"Updated : September 14, 2016, 4:40 pm","India hits out at UNHCHR, says ambiguities in its governance"
"Updated : September 14, 2016, 4:35 pm",AirAsia India plans 20 aircraft fleet size by 2018
"Updated : September 14, 2016, 4:29 pm",Directorate of Veterinary is hiring: Apply for 234 Veterinary Assistant posts
"Updated : September 14, 2016, 4:25 pm",NEWSALERT-SC-JUDGES 2
"Updated : September 14, 2016, 4:25 pm",AirAsia India plans 20 aircraft fleet size by 2018
"Updated : September 14, 2016, 4:25 pm",Start-ups to see turnaround in 1-2 years: Gopalakrishnan
"Updated : September 14, 2016, 11:54 am",India Blue in firm control vs India Red in Duleep Trophy final
"Updated : September 12, 2016, 8:48 am",Lost childhood: No rehabs for child drug addicts in Delhi government hospitals
"Updated : September 12, 2016, 12:35 am",ISIS faced major reversals in last 6-9 months: CIA Director
"Updated : September 11, 2016, 10:13 pm",Cheteshwar Pujara double ton helps India Blue take upper hand in Duleep Trophy final
"Updated : September 11, 2016, 4:30 pm","Strike rate never an issue, I always play with responsibility: Cheteshwar Pujara to India Today"
"Updated : September 11, 2016, 12:15 pm",Focus on Rohit as selectors meet to choose Test squad
"Updated : September 11, 2016, 12:15 pm",SPORT-IND-SELECTION 2 LAST
"Updated : September 11, 2016, 12:20 am",Cheteshwar Pujara's century drives India Blue to 362/3 in Duleep Trophy final
"Updated : September 10, 2016, 8:10 pm",Suggested BCCI to have pink ball games in Ranji: Rathour
"Updated : September 9, 2016, 9:45 pm",Governor visits RPO for renewal of passport
"Updated : September 9, 2016, 6:34 pm","Upen Patel, Aashka Goradia, Karan Patel; 5 TV celebs who moved on too soon"
"Updated : September 9, 2016, 5:19 pm",Red and pink balls behave in exactly the same way: Gautam Gambhir
"Updated : September 7, 2016, 11:51 pm",India Blue reach Duleep Trophy final after draw against India Green
"Updated : September 7, 2016, 11:12 pm","Spinner Pragyan Ojha suffers freak head injury, rushed to hospital"
"Updated : September 7, 2016, 10:25 pm","Indiabulls Housing mops up Rs 1,330-cr via masala bonds"
"Updated : September 7, 2016, 10:15 pm","Indiabulls Housing mops up Rs 1,330-cr via masala bonds"
"Updated : September 7, 2016, 8:57 pm","Virat Kohli rested; Rohit Sharma, Ravindra Jadeja, Shikhar Dhawan included for Duleep Trophy final"
"Updated : September 7, 2016, 8:20 pm",Over 500 coins seized at Attari border of antique value: ASI
"Updated : September 7, 2016, 1:48 pm",India Blue inch closer to seal Duleep Trophy final berth
"Updated : September 7, 2016, 11:06 am",Comedy Nights Bachao: Freaky Ali actress Amy Jackson has a problem with the show's format?
"Updated : September 7, 2016, 9:20 am",Game of Thrones season 7 casts Angela Lansbury?
"Updated : September 7, 2016, 6:15 am",Indian national held in Pak for smuggling
"Updated : September 6, 2016, 1:20 pm","Cheteshwar Pujara not impressed with pink ball, says batting is difficult"
"Updated : September 6, 2016, 11:58 am","Duleep Trophy: Pujara, Jackson centuries take India Blue to 707"
"Updated : September 6, 2016, 1:05 am",India grappling with shortage of health workforce: Nadda
"Updated : September 5, 2016, 7:45 pm",India grappling with shortage of health workforce: Nadda
"Updated : September 4, 2016, 4:19 pm",Virat Kohli may miss Duleep Trophy final
"Updated : September 3, 2016, 9:43 pm","Uttar Pradesh: Pregnant woman denied entry in hospital, dies after delivery"
"Updated : September 3, 2016, 8:20 pm","Ahead of gruelling home season, Kohli may miss Duleep final"
"Updated : September 3, 2016, 8:20 pm",Woman dies after delivering baby at health centre gate
"Updated : September 2, 2016, 7:30 pm",UP hospital denies treatment; HIV+ve woman gives birth to
"Updated : September 2, 2016, 7:30 pm",Maneka steps in to ensure treatment for HIV+ve woman who gave
"Updated : September 2, 2016, 4:40 pm",Combating NCDs to be key agenda at WHO summit next week
"Updated : September 1, 2016, 11:05 pm",INDO-AFRICA 2LAST
"Updated : August 31, 2016, 5:45 pm","India, US holding talks on development of vaccine against"
"Updated : August 31, 2016, 5:00 pm",NGO to run training campaign in schools for adolescents
"Updated : August 31, 2016, 2:50 pm",Boy suffering from thalassemia stated to have contracted HIV
"Updated : August 31, 2016, 2:35 pm",Boy suffering from thalassemia stated to have contracted HIV
"Updated : August 30, 2016, 12:55 pm",TUBERCULOSIS 2 LAST
"Updated : August 29, 2016, 10:30 pm",Duleep Trophy: India Blue reach 105/0 vs India Red as rain stops play
"Updated : August 26, 2016, 6:50 pm",Arunachal requests Centre to allow civilian use of ALGs
"Updated : August 26, 2016, 5:21 pm",Duleep Trophy: Kuldeep Yadav six-for leads India Red to 219-run win
"Updated : August 26, 2016, 10:03 am",Duleep Trophy: Kuldeep Yadav's five-for puts India Red on top
"Updated : August 25, 2016, 11:25 pm",One dead as bikes collide and catch fire
"Updated : August 25, 2016, 10:55 pm",One dead as bikes collide and catch fire
"Updated : August 25, 2016, 9:30 pm",TN cricketers picked for Duleep Trophy can play in TNPL: BCCI
"Updated : August 25, 2016, 4:35 pm","Clinton defends allegations on foundation, blasts Trump"
"Updated : August 25, 2016, 10:55 am",US nominates Jim Yong Kim as World Bank prez for 2nd term
"Updated : August 25, 2016, 12:30 am",Spray of natural pesticides in FCI godowns
"Updated : August 25, 2016, 12:00 am",Spray of natural pesticides in FCI godowns
"Updated : August 24, 2016, 4:25 pm",New smartphone app to help HIV patients adhere to medications
"Updated : August 24, 2016, 3:30 pm",405 babies of HIV infected mothers born wihtout infection
"Updated : August 24, 2016, 2:23 pm","Sports Wrap: Sakshi Malik targets Gold in Tokyo 2020, Haryana CM forgets PV Sindhu's name and more"
"Updated : August 24, 2016, 1:57 pm",Floodlight malfunction overshadows pink ball debut in Duleep Trophy
"Updated : August 24, 2016, 10:59 am",Bowlers dominate first day with pink ball in Duleep Trophy
"Updated : August 24, 2016, 10:48 am",Need more battery? 6 tips to make the phone last longer
"Updated : August 23, 2016, 2:39 pm","WikiLeaks spills its secrets, puts hundreds of private lives at risk"
"Updated : August 23, 2016, 9:32 am","Duleep Trophy: Yuvraj Singh, Suresh Raina gear up to play pink ball cricket"
"Updated : August 21, 2016, 9:55 am",SCIENCE 2
"Updated : August 21, 2016, 9:55 am",(Reopens FGN 5)
"Updated : August 21, 2016, 9:35 am",(Eds: This is the weekly column by well-known science writer
"Updated : August 21, 2016, 9:35 am",PUSHKARAM 2 LAST
"Updated : August 21, 2016, 9:15 am",All roads in Andhra leading to Krishna Pushkaram festival
"Updated : August 21, 2016, 9:10 am",BCCI-EXPERTS 2 LAST
"Updated : August 21, 2016, 8:55 am",SUICIDE 3 LAST
"Updated : August 21, 2016, 7:50 am",Pitbull announces new album with big collaborations
"Updated : August 21, 2016, 7:50 am",Michael Pena to star in horror thriller The Bringing
"Updated : August 21, 2016, 7:50 am",Willa Fitzgerald joins cast of indie drama Misfortune
"Updated : August 21, 2016, 7:50 am",Sarah Silverman pays tribute to mother
"Updated : August 21, 2016, 12:05 am",Serial murders: Police questions Pols wife in his presence
"Updated : August 20, 2016, 11:55 pm",My statement on liquor policy distorted by media: Ker Min
"Updated : August 20, 2016, 11:55 pm",Leprosy screening phase-II launch next month: Nadda
"Updated : August 20, 2016, 11:45 pm",Serial murders: Police questions Pols wife in his presence
"Updated : August 20, 2016, 11:30 pm",My statement on liquor policy distorted by media: Ker Min
"Updated : August 20, 2016, 11:25 pm",Leprosy screening phase-II launch next month: Nadda
"Updated : August 20, 2016, 11:00 pm",(REOPENS MDS7)
"Updated : August 19, 2016, 7:05 pm","NPPA cuts prices of malaria, HIV, cancer drugs by up to 45 pc"
"Updated : August 19, 2016, 2:45 pm","Cipla, Godrej recognised in Fortune Change the World list"
"Updated : August 18, 2016, 8:50 pm","Cipla, Godrej Consumer Products in Change the World list"
"Updated : August 18, 2016, 8:30 pm","We have many problems, waiting for solution: Chandrababu Naidu"
"Updated : August 18, 2016, 1:05 pm",Navy helicopter makes precautionary landing
"Updated : August 18, 2016, 12:15 pm",Navy helicopter makes precautionary landing
"Updated : August 18, 2016, 12:14 am",Revealing their HIV positive identity cost these workers their jobs
"Updated : August 16, 2016, 6:13 pm","Cheaters will be banned from playing Pokemon Go, says Niantic"
"Updated : August 15, 2016, 5:45 pm","6 per cent hike in DA for HP govt employees, pensioners"
"Updated : August 12, 2016, 6:35 pm",India name full strength squad for US tour
"Updated : August 12, 2016, 6:15 pm",Mizoram Health Min urges Church leaders to combat HIV/AIDS
"Updated : August 12, 2016, 12:08 pm",Amy Jackson teams up with 'Baahubali' Prabhas for his next
"Updated : August 12, 2016, 1:53 am",Pink ball to highlight Duleep Trophy in Noida's new stadium from August 23
"Updated : August 11, 2016, 6:46 pm","Watch: Finally, Indian truckers get their own condom brand"
"Updated : August 10, 2016, 10:55 pm",Gold bars worth Rs 15.6 lakh seized from AI pilot: Customs
"Updated : August 10, 2016, 6:09 pm",Stunning: Transgender model wears dress made from the flags of 72 countries where homosexuality is outlawed
"Updated : August 10, 2016, 5:45 pm","Customs Dept seized 46 pistols, other illegal items in FY16"
"Updated : August 10, 2016, 3:10 pm",Zika may lead to severe joint deformities in newborns: study
"Updated : August 9, 2016, 10:50 pm","TB is time-bomb, govt working to adress it: Health secy"
"Updated : August 8, 2016, 7:41 pm",Tobacco products smuggling posing serious problem: Sitharaman
"Updated : August 8, 2016, 4:35 pm",(Reopens PAR19)
"Updated : August 8, 2016, 11:21 am",Watch: Chinese man blocks licence plate with his body on a moving truck
"Updated : August 7, 2016, 9:15 pm",Uncertainty over D/N Duleep Trophy due to pink ball quality
"Updated : August 6, 2016, 8:45 pm",PB-AMARINDER 2 LAST
"Updated : August 6, 2016, 6:02 pm",Pokemon Go launched in 15 Asia-Pacific nations but not in India
"Updated : August 6, 2016, 5:00 pm",Cell subset contains chronic viral infection: China scientists
"Updated : August 6, 2016, 12:30 am",Vidarbha MLAs must unite on statehood issue: Groups
"Updated : August 5, 2016, 11:50 pm",Vidarbha MLAs must unite on statehood issue: Groups
"Updated : August 5, 2016, 4:40 pm",NACPs success shows that ending AIDS by 2030 realistic: Govt
"Updated : August 4, 2016, 11:10 pm",Mid term appraisal of National AIDS Control Programme released
"Updated : August 4, 2016, 11:10 pm",NACO 2 LAST
"Updated : August 4, 2016, 1:57 pm",Travel insurance: All you wanted to know
"Updated : August 3, 2016, 10:30 pm",Cabinet approves signing of ASA between India & Lao PDR
"Updated : August 3, 2016, 9:40 pm",Govt to hand-hold foreign investors in food processing sector
"Updated : August 3, 2016, 7:40 pm",Chinese boy seeks compensation for AIDS infection
"Updated : August 3, 2016, 5:25 pm","Alere eyes over 3-fold jump in India revenue to Rs 1,000 cr"
"Updated : August 2, 2016, 2:05 pm",US Ambassador visits Mumbai hospital
"Updated : August 1, 2016, 9:25 pm","Khattar inaugurates centre for detecting dengue, malaria, HIV"
"Updated : August 1, 2016, 4:10 pm","NPPA cuts prices of cancer, HIV, cardiac drugs by around 25%"
"Updated : July 31, 2016, 1:45 pm",Hetero Healthcare to set up units in three states
"Updated : July 31, 2016, 1:15 pm",Hetero Healthcare to set up units in three states
"Updated : July 31, 2016, 12:20 pm",TRAFFICKING 2 LAST
"Updated : July 29, 2016, 11:39 am",Hepatitis B and HIV bug may come free with your cool tattoo
"Updated : July 29, 2016, 10:15 am",Cant wait to see audiences reaction to my work: Nigel Akkara
"Updated : July 28, 2016, 7:10 pm",HEPATITIS-WHO 2 LAST
"Updated : July 28, 2016, 6:10 pm",DIAGNOSTICS TWO LAST
"Updated : July 28, 2016, 10:15 am",93.8 pc women in Goa have say in household decisions: survey
"Updated : July 28, 2016, 10:05 am",93.8 pc women in Goa have say in household decisions: survey
"Updated : July 27, 2016, 8:55 pm",RS member moots need for an effective model to combat LWE
"Updated : July 27, 2016, 6:15 pm",Viral hepatitis kills over 3 lakh people every year in SE
"Updated : July 25, 2016, 8:35 pm",182 people in Maha got HIV from blood transfusion: govt
"Updated : July 25, 2016, 8:25 pm",182 people in Maha got HIV from blood transfusion: govt
"Updated : July 25, 2016, 4:28 pm",A racket supplying drugs to Punjab youth busted in Delhi
"Updated : July 24, 2016, 7:25 pm","India asks MGC states to increase maritime, air connectivity"
"Updated : July 20, 2016, 10:25 pm",Cabinet approves Air Services Agreement with Mozambique
"Updated : July 20, 2016, 5:45 pm",About 1.96 lakh new HIV infections in India last year: study
"Updated : July 19, 2016, 8:35 pm",India will need aircraft worth USD 265 bn in 20 years: Boeing
"Updated : July 19, 2016, 8:15 pm",India will need aircraft worth USD 265 bn in 20 years: Boeing
"Updated : July 19, 2016, 4:47 pm",Here's why male birth control may not be available anytime soon
"Updated : July 19, 2016, 3:10 pm",Confidential info of 388 HIV patients feared leaked in China
"Updated : July 19, 2016, 1:35 pm",Racism an underlying cause of HIV: Charlize Theron
"Updated : July 19, 2016, 12:20 pm",HIV on the rise among injecting drug users
"Updated : July 18, 2016, 7:45 pm",China probes leak of confidential info of HIV patients
"Updated : July 18, 2016, 5:21 pm",Nokia may launch 2 Android phones by 2016-end. This time for real
"Updated : July 18, 2016, 1:05 am",Gates pledges USD 5 billion for Africas development
"Updated : July 14, 2016, 7:40 pm",Prince Harry takes HIV test live on Facebook
"Updated : July 13, 2016, 10:35 pm","Sex workers don new hat, turn paralegal volunteers"
"Updated : July 13, 2016, 7:35 pm","Sex workers don new hat, turn paralegal volunteers"
"Updated : July 13, 2016, 12:29 pm","'We are not closing centres at Noida, Jaipur, Mumbai': Pearl Academy"
"Updated : July 12, 2016, 5:05 pm",4 things your gynaecologist really wants you to know about a high-risk pregnancy
"Updated : July 12, 2016, 2:09 pm",Amy Jackson faces a harrowing experience in Ibiza
"Updated : July 12, 2016, 11:10 am","Delhi University releases cut offs for entrances, admission in technical and social sciences course"
"Updated : July 11, 2016, 11:00 pm","TB not just a medical problem, but a social issue: Badole"
"Updated : July 11, 2016, 10:30 pm","TB not just a medical problem, but a social issue: Badole"
"Updated : July 11, 2016, 7:16 pm",A group of guys taught this guy a lesson for not wearing a condom
"Updated : July 11, 2016, 12:35 pm",AIDS no longer public health issue in Aus: Experts
"Updated : July 10, 2016, 3:40 pm",Customs dept wants FPOs to be automated to check smuggling
"Updated : July 10, 2016, 2:00 pm",Customs dept wants FPOs to be automated to check smuggling
"Updated : July 9, 2016, 10:40 pm",HIV prevention programme launched in Punjab prisons
"Updated : July 9, 2016, 7:21 pm",'India's higher education is at cross-roads': C Rangarajan stresses on modernisation of syllabus
"Updated : July 9, 2016, 11:07 am",Happy Birthday Tom Hanks: The sanest superstar of our generation turns 60
"Updated : July 8, 2016, 10:00 pm",Raju to look at improving air connectivity to Surat
"Updated : July 8, 2016, 3:35 pm",DRUGS-RAJNATH 2 LAST
"Updated : July 7, 2016, 6:40 pm",MEDICINES-2LAST
"Updated : July 7, 2016, 6:35 pm",6 Indian pharma cos ink licensing pact with UN-backed MPP
"Updated : July 7, 2016, 4:05 pm",Zydus inks pact with Medicines Patent Pool for HepatitisC drug
"Updated : July 7, 2016, 3:15 pm",India should reject efforts weakening access to generic drugs
"Updated : July 6, 2016, 12:10 pm",India may soon get treatment for Hepatitis C
"Updated : July 5, 2016, 7:35 pm",CCTV cameras to be installed in 1056 police stations of Bihar
"Updated : July 5, 2016, 5:10 pm",ACADEMY 3 LAST
"Updated : July 5, 2016, 5:05 pm",Admissions for New Academic Year Now Open at Pearl Academy
"Updated : July 4, 2016, 10:51 am",Charlie Sheen wants to make career on British TV
"Updated : July 1, 2016, 1:50 pm",D/N Test against NZ was not feasible: BCCI Jt Secy
"Updated : July 1, 2016, 12:33 pm","Robot lawyer overturns 160,000 parking tickets in UK, US"
"Updated : June 30, 2016, 5:50 pm","Robot lawyer overturns 160,000 parking tickets in UK, US"
"Updated : June 30, 2016, 11:16 am",Most beautiful college campuses in India: Is yours amongst these?
"Updated : June 30, 2016, 9:09 am","5 gay celebrities demand right to sexuality, ask Supreme Court to quash Section 377"
"Updated : June 29, 2016, 7:04 pm",Planning to start a family 'late'? Here is some good news for you
"Updated : June 29, 2016, 12:25 pm",Prince Harry joins Coldplay onstage at Kensington Palace gig
"Updated : June 28, 2016, 3:01 pm",Your order of birth in the family says a lot about your personality
"Updated : June 28, 2016, 2:09 pm","4 types of drugs and what they do to your body: Heroin, Cocaine, Meth and LSD"
"Updated : June 27, 2016, 5:00 pm",Hetero launches colorectal cancer drug in India
"Updated : June 26, 2016, 6:21 pm",HIV-affected girl forced out of Central govt-run school hostel in Odisha
"Updated : June 24, 2016, 5:20 pm",Indian-origin lawyer to chair panel on human rights in S Sudan
"Updated : June 24, 2016, 4:50 pm","Shunned by his friends, this 22-year-old HIV positive student created an app for awareness"
"Updated : June 23, 2016, 11:07 pm","Really excited about pink ball cricket, says Ajinkya Rahane"
"Updated : June 22, 2016, 4:10 pm","Scientists discover Zika, dengue weaknesses"
"Updated : June 22, 2016, 12:10 pm",NAAT machine installed at MKCG Medical College & Hospital
"Updated : June 20, 2016, 3:25 pm",Anal exam: How Kenya checks if someone is gay or not
"Updated : June 19, 2016, 8:50 pm",JAITLEY 4 LAST
"Updated : June 17, 2016, 10:20 pm","Cipla in pact with Russian firm for HIV, Hepatitis C drugs"
"Updated : June 17, 2016, 6:15 pm","Shami, Wriddhiman to be part Indias first Pink ball game"
"Updated : June 17, 2016, 12:20 pm",Aus PM regrets inviting anti-gay Islamic preacher to iftar
"Updated : June 16, 2016, 8:08 pm","Pink-ball Test cricket is the way forward, says Sourav Ganguly"
"Updated : June 16, 2016, 2:05 pm","Woman finds out boyfriend is HIV positive, runs him over"
"Updated : June 15, 2016, 7:00 pm",Army man presumed dead returns home after 7 yrs
"Updated : June 15, 2016, 4:50 pm",Yoga should not be imposed on anybody: Mizo Guv
"Updated : June 15, 2016, 3:45 pm",Yoga should not be imposed on anybody: Mizo Guv
"Updated : June 15, 2016, 10:55 am",Kevin Harts house burgled
"Updated : June 15, 2016, 10:40 am",SOFTWARE 2
"Updated : June 15, 2016, 10:40 am",US appeals Afghanistan and Pakistan to calm tensions
"Updated : June 15, 2016, 10:40 am",SOFTWARE 3 LAST
"Updated : June 15, 2016, 10:20 am",KHOJ 2 LAST
"Updated : June 15, 2016, 10:20 am",Khoj artist residency explores themes of discrimination
"Updated : June 15, 2016, 10:10 am",WEBENGAGE 2 LAST
"Updated : June 15, 2016, 10:00 am",Donald Glover to join Spider-Man Homecoming
"Updated : June 15, 2016, 9:45 am",Encounter against South Korea was a quarterfinal for us: Sunil
"Updated : June 15, 2016, 8:15 am",Brooklyn Beckham misses bae Chloe Grace Moretz
"Updated : June 15, 2016, 1:31 am",(Updating with fresh inputs)
"Updated : June 15, 2016, 1:30 am",WHCA condemns Trump for revoking press credentials of Post
"Updated : June 15, 2016, 1:10 am",OBAMA-TRUMP 2LAST
"Updated : June 15, 2016, 12:45 am","Centre, TN to set up centre of excellence for blood donation"
"Updated : June 13, 2016, 10:36 pm",Orlando nightclub shooting: Here's why gay and bisexual men are barred from donating blood
"Updated : June 13, 2016, 9:03 am",8 risks of becoming a heart patient and here's how you can cut the threat
"Updated : June 12, 2016, 8:53 am","Health ministry pushes for sex education, to approach HRD ministry by next week"
"Updated : June 12, 2016, 8:40 am",RICE 2 LAST
"Updated : June 12, 2016, 8:40 am","Sex workers, HIV patients to get rice at Rs 2 per kg in Bengal"
"Updated : June 10, 2016, 10:00 pm",Increase budgetary allocation for northeast: Arunachal CM
"Updated : June 10, 2016, 8:00 pm","Pul for dual use of ALGs to boost tourism, communication in"
"Updated : June 10, 2016, 12:50 pm",India calls for flexibilities in IPR to combat AIDS
"Updated : June 10, 2016, 12:50 pm",INDIA-AIDS 2LAST
"Updated : June 9, 2016, 3:50 pm",(Reopens FGN17)
"Updated : June 9, 2016, 3:50 pm",INDIA-AIDS 3 LAST
"Updated : June 9, 2016, 3:35 pm",80% drugs to combat AIDS supplied by India: Nadda
"Updated : June 9, 2016, 3:30 pm",SPORT-BCCI-SCHEDU2 LT(SPB1)
"Updated : June 9, 2016, 3:20 pm",SPORT-BCCI-SCHEDULE 2 LAST
"Updated : June 9, 2016, 10:34 am","Why albinos are being abducted, mutilated, raped and killed in Africa"
"Updated : June 8, 2016, 6:45 pm",HC puts on hold govts decision to procure anti-drug medicine
"Updated : June 8, 2016, 5:45 pm",Blood Money: Blood banks making good money from pooling
"Updated : June 8, 2016, 3:59 pm",Maharashtra SSC: The board students may not come in first merit list
"Updated : June 8, 2016, 3:09 pm",Scientists can use CRISPR to customise your RNA: Difference between RNA and DNA
"Updated : June 8, 2016, 12:35 pm",Shimla to get reconnected by air from tomorrow
"Updated : June 7, 2016, 2:45 pm",COURT-OFFICER 2 LAST
"Updated : June 6, 2016, 9:35 pm","BHRC directs payment of Rs 50,000 compensation to HIV+ patient"
"Updated : June 6, 2016, 11:16 am",Bank earnings to remain weak in first half of FY17: Report
"Updated : June 6, 2016, 11:15 am",Bank earnings to remain weak in first half of FY17: Report
"Updated : June 3, 2016, 12:25 pm",40 dead tiger cubs found in Tiger Temple's freezer: 10 things you should know about controversy and temple
"Updated : June 2, 2016, 5:21 pm",Condemning Condoms: Why Russian experts want rubber banned
"Updated : June 1, 2016, 9:10 pm",2234 people reported to have got HIV after blood transfusion:
"Updated : June 1, 2016, 9:10 pm",BLOOD 2 LAST
"Updated : June 1, 2016, 6:24 pm","More than 2,000 people contract HIV after blood transfusions in India: Understanding the syndrome"
"Updated : June 1, 2016, 5:29 pm",DU girl Devika Sirohi decodes Zika Virus: All you need to know
"Updated : June 1, 2016, 1:49 pm",Scientists develop clone to fight against Zika Virus: Know all about the breakthrough
"Updated : May 30, 2016, 4:10 pm",CELL 4 LAST
"Updated : May 30, 2016, 10:10 am",Delhi High Court Rules Against Thermo Fisher Scientific Inc
"Updated : May 29, 2016, 7:36 pm","Ranji matches to played at neutral venues, zonal system scrapped in Duleep Trophy"
"Updated : May 29, 2016, 6:20 pm","Ranji games at neutral venues, Duleeps zonal system scrapped"
"Updated : May 27, 2016, 12:09 pm","Premature menopause is for real; if you're in your 30s, you ought to know all about it"
"Updated : May 26, 2016, 1:35 am",Nigerian held for duping woman of over Rs 16 lakh
"Updated : May 26, 2016, 1:20 am",Nigerian held for duping woman of over Rs 16 lakh
"Updated : May 24, 2016, 9:35 am",DEVICE 2
"Updated : May 24, 2016, 9:35 am",Non-Surgical Male Circumcision Device Approved
"Updated : May 24, 2016, 9:35 am",DEVICE 3 LAST
"Updated : May 19, 2016, 6:21 pm",Amy Jackson was at the same Cannes party as Kim Kardashian; here's what she wore
"Updated : May 19, 2016, 5:50 pm",Life expectancy worldwide has increased by 5 years: WHO
"Updated : May 19, 2016, 12:17 pm",Amy Jackson goes from glam girl to boss girl at Cannes
"Updated : May 19, 2016, 9:41 am","Over 7.36 lakh people to succumb to cancer in 2016, mumbers to shoot up to 8.8 lakh by 2020, says study"
"Updated : May 18, 2016, 9:00 pm",(REOPENS DEL57)
"Updated : May 18, 2016, 4:02 pm",How we zeroed in on the country's best Insurers
