"Updated : July 24, 2014, 12:25 pm",Why India remains one of the most populous subcontinents
"Updated : July 23, 2014, 11:43 am",Ruskin Bond's lessons in storytelling
"Updated : July 20, 2014, 12:05 pm","Barfi!, Paa or Ghajini: Bollywood banks on diseases for heart-rendering films"
"Updated : July 18, 2014, 11:05 pm",Black boxes recovered from wreckage of Malaysian passenger jet
"Updated : July 18, 2014, 6:08 pm","Indian-origin man, AIDS experts killed in Malaysian plane crash"
"Updated : July 18, 2014, 5:02 pm",Not Without Its Women
"Updated : July 18, 2014, 1:15 pm","Budget had nothing in it but homilies for women, as did the BJP manifesto"
"Updated : July 18, 2014, 9:50 am",Top AIDS experts among Malaysian flight crash victims
"Updated : July 16, 2014, 5:35 pm",CPT 2014 results declared by ICAI
"Updated : July 14, 2014, 11:02 pm",South African anti-apartheid author Nadine Gordimer dies at 90
"Updated : July 9, 2014, 10:48 am","AIDS menace engulfs Punjab, says Manjeet Sehgal"
"Updated : July 8, 2014, 11:53 am","Poverty, child, maternal deaths high in India: UN report"
"Updated : July 5, 2014, 9:25 pm",Prime Minister Narendra Modi likely to announce huge economic package for Nepal
"Updated : July 5, 2014, 3:09 pm",The Great Indian Secret: Why is everyone so afraid of sex education?
"Updated : July 4, 2014, 6:15 pm",The Great Indian Secret
"Updated : July 4, 2014, 9:52 am",2 Indian brothers who ran sex racket in UK jailed
"Updated : July 3, 2014, 8:12 pm",Here is an intra-vaginal ring that may prevent HIV
"Updated : June 28, 2014, 12:00 am","Sex education without vulgarity is fine, clarifies Dr Harsh Vardhan"
"Updated : June 27, 2014, 3:40 pm","Sex education in schools should be banned, says Harsh Vardhan"
"Updated : June 27, 2014, 12:17 pm",Nepal PM Sushil Koirala diagnosed with lung cancer
"Updated : June 26, 2014, 11:49 pm",Nepal PM Sushil Koirala diagnosed with lung cancer
"Updated : June 26, 2014, 10:15 am",Teen drinking menace needs firm handling
"Updated : June 25, 2014, 5:06 pm",Harsh Vardhan clarifies: Have no moral problem with condoms but they do break sometimes
"Updated : June 25, 2014, 3:23 pm",Harsh Vardhan's comments against condom promotion angers NGOs
"Updated : June 20, 2014, 10:20 am",Exclusive: No progress in Rs 321-cr GPS tracking project for women in distress
"Updated : June 18, 2014, 5:32 pm",Maharashtra State AIDS Control Society notifies recruitment at 28 posts
"Updated : June 8, 2014, 12:57 pm",10 reasons why we love birthday girl Shilpa Shetty
"Updated : June 7, 2014, 12:42 pm",Brothers in Arms
"Updated : June 4, 2014, 5:50 pm",National AIDS Control Organisation notifies recruitment
"Updated : June 3, 2014, 4:44 pm",All for a good cause
"Updated : June 2, 2014, 11:46 am",National Aids Research Institute recruits for 12 vacant posts 2014
"Updated : May 27, 2014, 6:48 pm",Top 7 dirtiest beaches in the world best avoided
"Updated : May 26, 2014, 3:53 pm","Antibiotics turning ineffective, says WHO report"
"Updated : May 25, 2014, 4:43 pm",Sumptuous snacks await Narendra Modi's guest on Monday
"Updated : May 23, 2014, 11:07 pm",Modi swearing-in to be secured from ground to air
"Updated : May 23, 2014, 4:07 pm",Mahinda Rajapaksa thanks Narendra Modi for inviting him for oath ceremony
"Updated : May 23, 2014, 10:37 am",Nepal Prime Minister Sushil Koirala to attend Modi's swearing-in
"Updated : May 18, 2014, 12:36 pm",ISC Class 12 results 2014: Pass percentage at 95.26
"Updated : May 17, 2014, 4:36 pm",ISC Class 12 Results 2014: To be declared today at 3 pm
"Updated : May 17, 2014, 4:24 pm","ISC Class 12 Exam Results 2014: Announced, check online"
"Updated : May 16, 2014, 5:46 am",Government hospitals in Delhi lack life-saving drugs
"Updated : May 15, 2014, 5:07 pm",ISC Class 12 Exam Results 2014 to be declared on May 17 at 3 PM
"Updated : May 15, 2014, 11:06 am",Ritu Bhatia on how private doctors are fleecing the poor
"Updated : May 12, 2014, 5:55 pm",CISCE ISC Class 12 exam last year highlights
"Updated : May 8, 2014, 4:22 pm",Inspired curiosity
"Updated : May 8, 2014, 4:21 pm",Unleashing creativity with Brandstorm 2014
"Updated : May 4, 2014, 1:24 pm",Centre steps in to shield HIV patients
"Updated : April 29, 2014, 11:17 am",Elections 2014: Promise of good health in the air
"Updated : April 26, 2014, 2:11 pm","""They have performed last rites for me in my village. My father told them I was dead."""
"Updated : April 25, 2014, 11:23 am","Caught for traffic violation, US teen found hiding revolver in vagina"
"Updated : April 25, 2014, 11:10 am",From Vadodara to Varanasi: Narendra Modi's assets rise by Rs 14 lakh
"Updated : April 23, 2014, 2:44 pm",Watch: Ranveer Singh asks lovers all over the world to use Durex
"Updated : April 23, 2014, 11:19 am","Cool dude Ranveer Singh has a condom in his pocket, always"
"Updated : April 21, 2014, 10:26 am",Indian Maritime University invites application for admission to UG and PG courses
"Updated : April 9, 2014, 6:05 am",Include iron in your diet
"Updated : April 1, 2014, 1:19 pm",Education system in India discourages creativity: Educationist Soumitra Dutta
"Updated : March 14, 2014, 6:03 pm",OSACS invites applications for 11 Counselor Posts 2014
"Updated : March 14, 2014, 3:08 pm",Discovered: A gel which could protect humans against AIDS
"Updated : March 14, 2014, 9:38 am",No efforts to curb growing numbers of illegal doctors in Delhi
"Updated : March 12, 2014, 12:21 pm",Revealed: How Twitter shapes public opinion
"Updated : March 12, 2014, 10:35 am",Young Yearners 2013: MRSK Chaitanya
"Updated : March 11, 2014, 2:42 pm",ISC 2014 Class 12 History exam rescheduled due to Lok Sabha poll dates
"Updated : March 10, 2014, 6:12 pm",Fresh guidelines outlined on medical care to rape victims
"Updated : March 10, 2014, 12:22 am",Aishwarya gets teary-eyed at UN AIDS event
"Updated : March 8, 2014, 9:57 am",Politically correct at Oscars
"Updated : March 8, 2014, 9:35 am",Flagging issues from Oscar stage
"Updated : March 7, 2014, 5:59 pm",Pre Oscar: Lupita's racy session with two men in Kenyan soap opera
"Updated : March 6, 2014, 4:18 pm",New intravaginal ring protects against HIV as well as unwanted pregnancy
"Updated : March 6, 2014, 12:31 pm",AIDS no longer a death sentence
"Updated : March 6, 2014, 8:47 am",Ritu Bhatia talks about the great dietary dilemma
"Updated : March 4, 2014, 3:10 pm",Jared Leto has not seen Dallas Buyers Club yet
"Updated : March 4, 2014, 11:38 am",Supreme Court issues notice on discrimination against HIV children
"Updated : March 4, 2014, 10:10 am",Supreme Court seeks reply to discrimination against HIV-positive students
"Updated : March 3, 2014, 1:22 pm",Oscar 2014 winners: Ecstatic celebs pose with the golden trophy
"Updated : March 3, 2014, 8:56 am",Jared Leto wins Oscar for Best Supporting Actor
"Updated : March 2, 2014, 5:44 pm","Twitter can be used to monitor HIV, drug-related behaviour"
"Updated : March 1, 2014, 5:00 pm",Indian American Vivek Murthy poised to become 'America's doctor'
"Updated : March 1, 2014, 2:08 pm",Movie review: Dallas Buyers Club is an intriguing slice of life
"Updated : February 28, 2014, 5:27 pm",Google Glass can potentially help save lives: Study
"Updated : February 27, 2014, 12:50 pm","Hepatitis C, a silent killer for Delhi's youth"
"Updated : February 27, 2014, 12:44 pm",Movie review: Dallas Buyers Club is a powerful film
"Updated : February 21, 2014, 12:00 pm",ICFAI ATIT 2014: The application procedure
"Updated : February 19, 2014, 5:48 pm",ICFAI Tripura invites LLB programme applications
"Updated : February 11, 2014, 7:03 pm",Breaking News Coverage at India Today on February 11
"Updated : February 11, 2014, 5:24 am",Canadian vending machines now sell crack cocaine pipes for drug users
"Updated : February 11, 2014, 12:13 am",Sushil Koirala becomes new Prime Minister of Nepal
"Updated : February 7, 2014, 2:58 pm",Chennai sex workers demand separate work area
"Updated : February 5, 2014, 4:31 pm",Singer Arijit Singh ties the knot (picture inside)
"Updated : February 3, 2014, 11:52 pm","In the Shadow of Stigma: A spate of AIDS-related deaths in 2008 has forced a hamlet in Madhya Pradesh's Sehore district to seek refuge in ignorance, exclusion and denial"
"Updated : January 31, 2014, 1:37 pm",Gay rights activists flag protest after Sec 377 stay
"Updated : January 29, 2014, 8:11 am",Sec 377 stays: SC refuses to review verdict on gay sex
"Updated : January 28, 2014, 2:08 pm",SC to take up plea seeking review of its verdict on gay sex today
"Updated : January 27, 2014, 2:49 pm",HIV+ boy of US university has unsafe sex with 32 people and films them all
"Updated : January 26, 2014, 4:34 pm","Kamal Haasan, Ruskin Bond among 127 Padma awardees this year"
"Updated : January 23, 2014, 9:31 am",The truth about superfoods by Ritu Bhatia
"Updated : January 22, 2014, 12:47 am",Gates says poor countries not doomed to stay poor
"Updated : January 20, 2014, 3:36 pm",ICFAI Business School Aptitude Test (IBSAT) results announced
"Updated : January 19, 2014, 12:05 pm",American Hustle tops Screen Actor Guild Awards
"Updated : January 17, 2014, 7:34 pm",Oscars 2014: And the Best Picture nominees are...
"Updated : January 16, 2014, 8:06 pm",Oscars 2014: Nominees for Actor in a Leading Role
"Updated : January 15, 2014, 10:00 pm","Ram Charan Teja, 9 others booked for obscenity in 'Yevadu' posters"
"Updated : January 13, 2014, 6:18 pm","Golden Globe Awards 2014: American Hustle leads, 12 Years A Slave takes best drama"
"Updated : January 11, 2014, 3:17 pm",Deadly Dialogues in 2013
"Updated : January 10, 2014, 2:31 pm",AIPGDEE 2014: Tips and Tricks
"Updated : January 5, 2014, 12:47 pm","Sharon Stone, Kesha to attend debut amfAR gala in Mumbai"
"Updated : January 4, 2014, 12:13 pm",Karnataka minister occupies 'lucky' office allotted to some other colleague
"Updated : January 4, 2014, 8:29 am",Indian envoy on the job to resolve Devyani Khobragade issue
"Updated : December 30, 2013, 12:39 pm",Khobragade issue: US forced to begin inter-agency review
"Updated : December 28, 2013, 5:14 pm",Naveen Patnaik: The man who transformed Odisha
"Updated : December 28, 2013, 5:13 pm",10 things you don't say to people of other sexualities
"Updated : December 25, 2013, 8:07 pm",Modi's tactics creates friction within ruling UDF in Kerala
"Updated : December 21, 2013, 5:24 pm",US scientists identify drug for AIDS treatment
"Updated : December 20, 2013, 3:47 pm",ISC Class 12th Datesheet 2014
"Updated : December 20, 2013, 2:54 pm",Khobragade issue: Protests outside US consulate in Hyderabad
"Updated : December 18, 2013, 7:01 pm",Fight to take back our rights
"Updated : December 18, 2013, 3:21 pm",BJP and Modi get positive signals from Congress allies
"Updated : December 16, 2013, 12:49 pm",Straight and narrow
"Updated : December 14, 2013, 9:22 pm",Sonia Gandhi trying to spread unnatural European practices: Azam Khan on homosexuality
"Updated : December 14, 2013, 9:58 am",Judge ignored affidavits in gay ruling: Lawyers for LGBT community
"Updated : December 12, 2013, 8:30 am","LGBT community expresses shock as Supreme Court rules gay sex illegal, calls it a 'black day'"
"Updated : December 11, 2013, 6:22 pm",Not-so-straight: Bollywood's gay films
"Updated : December 11, 2013, 1:25 pm","Homosexuality an offence: SC has put the decision back to parliament, say LGBT activists"
"Updated : December 10, 2013, 3:06 pm",Most schoolgirls in Agra ignorant about HIV/AIDS: Survey
"Updated : December 7, 2013, 3:40 pm",Vivek Murthy set to become the first Indian-American surgeon general
"Updated : December 6, 2013, 10:00 am",Nelson Mandela: Some details that you might not have known about him
"Updated : December 5, 2013, 6:43 pm",Netherlands woman sells female condoms in a belly tray in Kochi
"Updated : December 5, 2013, 10:18 am",Winter session of Parliament: UPA govt's last chance for key legislations
"Updated : December 4, 2013, 12:34 pm",No proof Yasser Arafat was poisoned by radioactive polonium: French expert report
"Updated : December 1, 2013, 2:48 pm",World AIDS Day: HIV positive couple to tie the nupital knot
"Updated : November 29, 2013, 5:23 pm",Right Prescription
"Updated : November 29, 2013, 11:14 am",New aggressive strain of HIV causes AIDS two years faster
"Updated : November 28, 2013, 9:49 am",In search of a Hero
"Updated : November 27, 2013, 3:45 am",Transgenders accused of forcing 19-year-old boy to undergo sex change operation resist trial in Mahila court
"Updated : November 26, 2013, 6:25 pm",Pill popper: Cipla's Yusuf Hamied changes fate of millions
"Updated : November 26, 2013, 1:13 pm","AIDS: To Indians, the threat is no longer a distant one"
"Updated : November 19, 2013, 2:02 pm","Hilary Swank, Sharon Stone attend inauguration of amfAR in India"
"Updated : November 15, 2013, 2:54 pm",Jessie J and Heidi Klum auction for charity
"Updated : November 14, 2013, 6:00 pm",World's first vegan condom launched in hilarious ad
"Updated : November 11, 2013, 7:40 am",'Game changer' food security scheme fails reality test
"Updated : November 9, 2013, 11:18 am",Priyanka Chopra shines at Alicia Keys' NY charity do
"Updated : November 8, 2013, 3:44 am","Israel denies having poisoned Arafat, PLO demands international investigation"
"Updated : October 31, 2013, 4:07 pm",The city zen
"Updated : October 30, 2013, 1:06 am",Falling growth rate and swelling unemployment to haunt Gehlot in coming elections
"Updated : October 24, 2013, 2:12 pm","Sex as trade and tradition: For Bedia families, sex is a family business where young girls engage in prostitution with the consent of the community"
"Updated : October 21, 2013, 7:16 pm","Dengue-struck Unmukt Chand returns home, likely to miss Ranji Trophy camp"
"Updated : October 11, 2013, 5:49 pm","Kerala man flaunts his HIV infection as 'weapon', bites two cops"
"Updated : October 10, 2013, 6:50 pm",AIDS scare hampers rescue operations of prostitutes in Tamil Nadu
"Updated : October 10, 2013, 5:05 pm",Movie Review: Fire in the Blood
"Updated : October 8, 2013, 5:26 pm",Pearls of chic wisdom
"Updated : October 4, 2013, 5:34 pm",Plan to isolate and rehabilitate infected prostitutes fails to work
"Updated : October 4, 2013, 12:12 pm",AIDS carrier continues to be detained for fear that she may spread the disease
"Updated : September 30, 2013, 6:35 pm",Private blood banks are repositories of lethal diseases
"Updated : September 27, 2013, 10:48 am",The ultimate aim is to reach a point where trading will be done on a computer: M.R. Mayya
"Updated : September 25, 2013, 9:52 pm","AIDS alarm in Noida, 51 test HIV positive since January"
"Updated : September 18, 2013, 10:54 am",Indian-American among those killed in Washington shooting
"Updated : September 10, 2013, 5:08 pm",I know I am going to be okay: says a HIV+ mother
"Updated : September 8, 2013, 7:50 pm",Porn filming suspended after third actor tests HIV-positive
"Updated : September 7, 2013, 3:53 pm","HIV cloud looms over US porn industry, another female actor tests positive"
"Updated : September 7, 2013, 3:52 pm","After coal scam comes CONDOM scam. CAG finds 10,000 vending machines missing"
"Updated : September 7, 2013, 12:32 pm","Female actor tests positive for HIV, shuts down porn industry"
"Updated : September 6, 2013, 12:19 pm",I do not think that national interest is a function of the party in power: Arjun Singh
"Updated : September 5, 2013, 3:57 pm",India threatened by AIDS epidemic as disease spreads to all sections of society
"Updated : September 5, 2013, 9:09 am",Killing for cancer care
"Updated : August 30, 2013, 12:09 pm",Project Saheli: Bombay prostitutes insist on use of condoms
"Updated : August 23, 2013, 5:24 pm",Book review: Atima Srivastava's 'Transmission'
"Updated : August 23, 2013, 4:18 pm",'I want to recover fully and help other victims during the rest of my life'
"Updated : August 23, 2013, 4:13 pm",I have been forced to abandon my children: Batwa
"Updated : August 23, 2013, 4:07 pm",I am at peace inside my home: Rohit Oberoi
"Updated : August 23, 2013, 12:42 pm",Babas and their sex scandals
"Updated : August 22, 2013, 3:31 pm","Female actor tests positive for HIV, shuts down porn industry"
"Updated : August 22, 2013, 1:52 pm",HIV test prompts proposal for porn film moratorium
"Updated : August 21, 2013, 1:13 pm",B-town's on-screen brothers and sisters
"Updated : August 21, 2013, 11:29 am",Dental surgery can land you with HIV and other deadly infections
"Updated : August 20, 2013, 10:30 am",Films celebrating brother-sister bond few and subtle in today's Bollywood
"Updated : August 8, 2013, 9:50 am","God's own country not safe for kids anymore, the flip side of Kerala's growth rate"
"Updated : August 6, 2013, 12:45 pm",New anxiety syndrome breaks out in Kerala
"Updated : July 27, 2013, 3:03 pm",AIDS stigma still stays! UP kids ostracised after parents died due to HIV
"Updated : July 26, 2013, 3:04 pm","'The BJP is virtually taken over by the VHP, RSS and Bajrang Dal'"
"Updated : July 25, 2013, 11:43 am",Burka Avenger is Pak's new superhero!
"Updated : July 24, 2013, 3:43 pm",Kerala electrician risks life to marry an AIDS carrier
"Updated : July 19, 2013, 11:22 am","New breed of doctors, quacks proclaim miracle cures for AIDS dupe patients for huge bucks"
"Updated : July 15, 2013, 6:37 pm",Latest book releases
"Updated : July 12, 2013, 4:04 pm",Marriage bureaus arrange matches for HIV-carriers in Bombay
"Updated : July 12, 2013, 3:07 pm",AIDS awareness succeeds by involving prostitutes in Calcutta
"Updated : July 9, 2013, 5:34 pm",Plays in Delhi
"Updated : July 8, 2013, 4:26 pm",Drug addicts turn to painkiller injections in Calcutta
"Updated : July 6, 2013, 5:57 pm","Brahmaputra floods wreak havoc in Assam, displace over one lakh in state"
"Updated : July 5, 2013, 10:27 pm",India to have its string of navigation satellites for saturated coverage of the sub continent
"Updated : July 5, 2013, 2:28 pm","Infused with wrong blood group, anaemic patient dies in Bangalore hospital"
"Updated : July 5, 2013, 1:43 pm",Prostitutes working in India go back to Nepal carrying AIDS virus
"Updated : July 4, 2013, 6:56 pm",Ancient systems of medicine modernise to give allopathy a run for its money- naturally
"Updated : July 4, 2013, 2:08 pm","2 AIDS patients stop HIV drugs after marrow transplant, no relapse seen yet"
"Updated : July 2, 2013, 5:34 pm",Gays advocate non-penetrative sex to combat AIDS
"Updated : July 2, 2013, 2:46 pm","Enthused by gain from Somalia, Combodia, India to expand its role in UN peacekeeping"
"Updated : July 2, 2013, 7:46 am",India enters new era of space applications with successful launch of IRNSS
"Updated : June 30, 2013, 5:29 pm","Barack Obama's tribute to ailing Mandela, visits his former jail before delivering a speech in Africa"
"Updated : June 25, 2013, 6:11 pm",Scandalous state of blood screening exposed as thalassemia children turn up HIV positive
"Updated : June 24, 2013, 5:42 pm",Indian Red Cross Society blood bank shuts down for lapse
"Updated : June 23, 2013, 11:25 am",Young men in Gujarat take to sperm donation for easy buck
"Updated : June 20, 2013, 7:43 pm","Violence against women causes global health epidemic, says WHO report"
"Updated : June 20, 2013, 6:57 pm",Housewives fall prey HIV virus that causes AIDS
"Updated : June 19, 2013, 6:39 pm",Crackdown on Ujjain's prostitutes adds to their suffering
"Updated : June 19, 2013, 4:55 pm",Unwanted pregnancies on the rise in cities as young women savour their sexual freedom
"Updated : June 19, 2013, 4:37 pm",Tabla maestro Pandit Nikhil Ghosh passes away
"Updated : June 19, 2013, 12:53 pm",Bold new programmes on FM radio tackle sexuality and AIDS
"Updated : June 19, 2013, 11:24 am",Last day to submit DU admission forms
"Updated : June 19, 2013, 10:52 am",Countdown to launch India's own GPS begins
"Updated : June 17, 2013, 10:38 pm",Gogoi announces Rs 5 lakh compensation for HIV-infected blood recipients
"Updated : June 16, 2013, 9:15 am",PSST... condom please. Survey finds women take the lead on bed as men shy to use protection
"Updated : June 16, 2013, 9:01 am","PSST... Condom please. Women have started to equip their partners with necessary protection for safe sex, says survey"
"Updated : June 16, 2013, 7:45 am",Scores contract AIDS after Assam hospital transfers HIV infected blood
"Updated : June 14, 2013, 9:43 pm",60-year-old woman gives birth to her fourth child in Indore
"Updated : June 14, 2013, 10:54 am",Virulent strains of old diseases sweep India even as new ones take root
"Updated : June 14, 2013, 10:50 am",Range of killer diseases take India in their grip
"Updated : June 11, 2013, 4:20 pm","As soaps explode, it is boomtime for scribes"
"Updated : June 11, 2013, 1:13 pm",'The election in Kashmir maybe the first step towards restoring normalcy in that state'
"Updated : June 8, 2013, 3:55 pm","Tissue Trumps Transplant: After organ transplants, tissue grafts are no less life-saving"
"Updated : June 8, 2013, 12:44 pm","Nelson Mandela discharged from hospital, to get home-based high care"
"Updated : June 7, 2013, 3:43 pm",Make-A-Wish Foundation visits terminally ill kids to make their wish come true
"Updated : June 6, 2013, 4:16 pm",Doctors in Capital reflect low awareness level about HIV and AIDS in new study
"Updated : June 6, 2013, 1:08 pm","US student hacks ICSE website, exposes anomalies in results"
"Updated : June 6, 2013, 12:14 pm",Confederation of Indian Industry releases a manual on family health care
"Updated : June 3, 2013, 3:14 pm",High Spirits
"Updated : June 2, 2013, 4:07 pm","This bank gives out mother's milk, saves many frail and preterm babies"
"Updated : May 31, 2013, 10:32 am",Himanshu Roy: Mumbai's superpoliceman
"Updated : May 30, 2013, 12:10 pm",CII develops programme to demystify risks of AIDS for industrial workers
"Updated : May 29, 2013, 7:07 pm",She's every woman...
"Updated : May 29, 2013, 5:05 pm","Chinese scientists develop world's first vaccine for hand, foot and mouth disease"
"Updated : May 29, 2013, 11:05 am",Mail Today impact: Activists and sex workers oppose government's move to criminalise paid sex
"Updated : May 27, 2013, 1:16 pm",Rise in cases of children born with HIV-positive project dark picture of India's future
"Updated : May 26, 2013, 3:40 pm","India is regressive for women, says Mallika Sherawat"
"Updated : May 24, 2013, 2:12 pm",Fear of AIDS stalks citizen of Calcutta
"Updated : May 23, 2013, 1:07 pm",Commercial sex workers seek legal status
"Updated : May 21, 2013, 6:19 pm",NGOs face financial crisis as racketeers masquerading as voluntary outfits siphon off funds
"Updated : May 21, 2013, 10:30 am",NRI found dead in Lucknow in mysterious circumstances
"Updated : May 20, 2013, 4:07 pm","Tuberculosis no longer respect social classes, makes disease a potential health disaster"
"Updated : May 18, 2013, 1:14 pm",HIV-affected people in Goa get 'wake up call'
"Updated : May 16, 2013, 1:36 pm",Delhi cracks down on a tribe of illegal doctors
"Updated : May 16, 2013, 1:34 pm",Former mining engineer from Kerala claims to have cure for AIDS
"Updated : May 16, 2013, 8:54 am",Rocket blasts off from Florida carrying new GPS satellite
"Updated : May 13, 2013, 2:00 pm",Chennai-based physician not only treats AIDS patients but also ministers to their souls
"Updated : May 7, 2013, 4:20 pm",Chronic obsession with sex: India is waking up to the illness and finding ways to treat it
"Updated : May 6, 2013, 5:23 pm","What could be worse than AIDS? A newly discovered sex superbug, say doctors"
"Updated : May 3, 2013, 2:07 pm","More infectious than HIV, hepatitis virus takes growing toll in India"
"Updated : May 2, 2013, 4:25 pm",President Bush visit to India promises to transform Indo-US relations
"Updated : May 2, 2013, 4:13 pm","India-US ties touch historic high, Washington agrees to share civilian nuclear technology"
"Updated : April 28, 2013, 7:14 pm",Breakthrough for HIV could be only months away
"Updated : April 26, 2013, 4:06 pm",Bad news for AIDS patients! US halts study as latest HIV vaccine doesn't work
"Updated : April 25, 2013, 2:50 pm",Tragedy stares India's middle class in the face as AIDS virus moves beyond red-light areas
"Updated : April 23, 2013, 11:34 am",Two arrested in al-Qaeda linked Canada plot to attack a passenger train
"Updated : April 18, 2013, 4:13 pm",Nokia trims loss in first quarter as Lumia sales pick up
"Updated : April 18, 2013, 3:06 pm",Performers and sports stars die younger than businessmen
"Updated : April 15, 2013, 6:31 pm","With 45 mn carriers of hepatitis, almost 5 mn die of liver disease annually in India"
"Updated : April 12, 2013, 12:59 pm",Only for an emergency: Quick-fix pills may seem like answer to unwanted pregnancies but frequent usage can be dangerous
"Updated : April 11, 2013, 11:23 am","Bill Clinton urges India to empower its women, lauds Indian generic pharma companies"
"Updated : April 10, 2013, 11:32 pm",Obama hikes American aid to Pakistan by 40 per cent in new budget
"Updated : April 4, 2013, 2:49 pm",Ask Radhika
"Updated : April 4, 2013, 11:53 am",Government organisations play numbers game even as HIV cases increase
"Updated : April 1, 2013, 12:06 pm","Rituparno Ghosh makes 'Asukh' on father-daughter relationship, AIDS"
"Updated : April 1, 2013, 10:20 am",Supreme Court to pass landmark judgement on Novartis pharma patents case today
"Updated : March 31, 2013, 5:15 pm",From sexy to deadly! Get ready for some high voltage girl power with sensor charged lingerie
"Updated : March 29, 2013, 6:23 pm","Fearing infection, hospitals turn away tattooed blood donors"
"Updated : March 28, 2013, 2:19 pm","Government agencies flout own pest control norms, encougarge farmers to use chemical pesticides, finds CSE study"
"Updated : March 28, 2013, 12:15 am","Govt agencies flout its own pest control norms, reveals study"
"Updated : March 25, 2013, 6:04 pm","Sanctions are softer than expected, but India finds its best bet is still good economics"
