"Updated : December 9, 2015, 8:25 pm","Occupy UGC protesters march to Parliament, 150 detained"
"Updated : December 9, 2015, 4:50 pm",PHARMA 2 LAST
"Updated : December 9, 2015, 7:20 am",Ive no sympathy for Charlie Sheen: Burt Reynolds
"Updated : December 8, 2015, 11:05 pm",Intl community concerned over shortages of medicines in Nepal
"Updated : December 8, 2015, 7:30 pm",GUJ-TOURISM 2 LAST (BCM28)
"Updated : December 8, 2015, 7:10 pm",GUJ-TOURISM 2 LAST
"Updated : December 7, 2015, 9:25 pm",CLIMATE-JAVADEKAR 2 LAST
"Updated : December 4, 2015, 4:45 pm",Charlie Sheen demands USD 10 million for memoir?
"Updated : December 4, 2015, 4:35 pm",Charlie Sheen is HIV positive; expected to talk about it on live TV
"Updated : December 4, 2015, 4:34 pm","The aftermath of Charlie Sheen's disclosure, and his open letter"
"Updated : December 4, 2015, 11:00 am",CIPLA 3 LAST
"Updated : December 3, 2015, 5:15 pm","Cheap, disposable device for diagnosing diseases"
"Updated : December 3, 2015, 8:00 am",Taraji P Henson joins Alicia Keys charity
"Updated : December 2, 2015, 7:05 pm",79 AIDS deaths since 1992 in Andaman and Nicobar islands
"Updated : December 2, 2015, 6:35 pm",79 AIDS deaths since 1992 in Andaman and Nicobar islands
"Updated : December 2, 2015, 6:31 pm",#WorldAIDSDay: 4 FAQs everybody should read about HIV/AIDS
"Updated : December 2, 2015, 5:41 pm",World AIDS Day: Is the youth under AIDS attack?
"Updated : December 2, 2015, 4:55 pm",India trails on two targets under Millennium Development Goals
"Updated : December 2, 2015, 3:40 pm",India trails on two targets under Millennium Development Goals
"Updated : December 2, 2015, 2:16 pm",Complaints flood pharma grievance cell over availability of medicines
"Updated : December 2, 2015, 1:15 pm",Nagaland observes World Aids Day
"Updated : December 2, 2015, 10:25 am",Why Aishwarya Rai thinks World AIDS Day is as important as any other festival
"Updated : December 1, 2015, 9:20 pm",AIDS 2 LAST
"Updated : December 1, 2015, 8:00 pm",Cgarh: 179 HIV infected women deliver healthy babies this yr
"Updated : December 1, 2015, 6:20 pm",Arunachal Speaker stresses on HIV patient friendly environment
"Updated : December 1, 2015, 6:03 pm",World AIDS Day: HIV infections in young gay men surge due to mobile dating
"Updated : December 1, 2015, 6:00 pm",Arunachal Speaker stresses on HIV patient friendly environment
"Updated : December 1, 2015, 5:53 pm",Dating apps put Asian teens at risk of HIV infection: UN
"Updated : December 1, 2015, 5:10 pm","New Delhi: Dec 01, 2015 (PTI) EDITORS: Photos with"
"Updated : December 1, 2015, 4:20 pm",(RPTG ADDING PARA 2)
"Updated : December 1, 2015, 4:10 pm",Cgarh: 179 HIV infected women deliver healthy babies this yr
"Updated : December 1, 2015, 3:55 pm",Singapore reports 380 HIV cases this year
"Updated : December 1, 2015, 3:55 pm",ART can help HIV positive person live normal lifespan: Expert
"Updated : December 1, 2015, 3:25 pm","Drug price cut yielded Rs 2,772-cr benefit to public: Govt"
"Updated : December 1, 2015, 3:00 pm",ART can help HIV positive person live normal lifespan: Expert
"Updated : December 1, 2015, 2:19 pm",World AIDS Day: All you need to know about the disease
"Updated : December 1, 2015, 9:40 am",HIV 2 LAST
"Updated : November 30, 2015, 11:23 pm",AIDS 2 LAST
"Updated : November 30, 2015, 11:23 pm",China has 5.75 lakh people with HIV/AIDS
"Updated : November 30, 2015, 11:23 pm",30 died of HIV infection in Tripura in 2014-15
"Updated : November 30, 2015, 11:23 pm",Now a free online library of HIV edu material with interactive
"Updated : November 30, 2015, 11:22 pm","Assam, Tripura records increase in new HIV cases"
"Updated : November 30, 2015, 11:21 pm",AIDS 2 LAST
"Updated : November 29, 2015, 8:57 pm","Prince Harry living dangerously, falls from his pony"
"Updated : November 29, 2015, 6:40 pm",Prince Harry falls from polo pony at charity match in S.Africa
"Updated : November 28, 2015, 9:00 pm",Kidney of brain dead person given to woman patient
"Updated : November 28, 2015, 8:40 pm",HP minister to attend global conference on lung health
"Updated : November 27, 2015, 8:40 pm",India going to Paris meet with progressive & proactive
"Updated : November 27, 2015, 12:35 pm","Free screening of Malala documentary in Maha, Ktaka tomorrow"
"Updated : November 27, 2015, 12:25 pm","Free screening of Malala documentary in Maha, Ktaka tomorrow"
"Updated : November 25, 2015, 4:47 pm","Uber looks for talent on Wall Street, hires 3 Goldman bankers"
"Updated : November 25, 2015, 1:15 pm",(Attn.editors: The following press release comes to you under
"Updated : November 25, 2015, 1:10 pm",Shrine Board asks DGCA to conduct Heli services safety audit
"Updated : November 25, 2015, 1:05 pm",PET CARE 2
"Updated : November 25, 2015, 1:00 pm",(Attn.editors: The following press release comes to you under
"Updated : November 25, 2015, 1:00 pm",MINDTREE 3 LAST
"Updated : November 25, 2015, 12:40 pm",89th INAC cadets awarded graduation certificates
"Updated : November 25, 2015, 12:20 pm","Poet Kuvempus house burgled, Padma medals stolen"
"Updated : November 24, 2015, 1:13 pm",A singular man
"Updated : November 23, 2015, 10:15 pm",Easy to talk about diseases in documentary than in film: Big B
"Updated : November 23, 2015, 9:50 pm",Easy to talk about diseases in documentary than in film: Big B
"Updated : November 23, 2015, 8:30 pm",Indias vaccination prog to reach 90% within 3 years: Nadda
"Updated : November 23, 2015, 8:00 pm",Indias vaccination prog to reach 90% within 3 years: Nadda
"Updated : November 23, 2015, 12:08 pm",4 preventive steps you MUST take to keep your joints stronger
"Updated : November 23, 2015, 11:52 am",CISCE ISC (Class 12) Exams 2016: Marking scheme changed
"Updated : November 23, 2015, 10:07 am",Durex wants condom emoji so people can have safe sex
"Updated : November 22, 2015, 3:20 pm",Biopic on noted Assamese folk singer Pratima Barua-Pandey
"Updated : November 21, 2015, 11:15 am",Indian-American killed in Mali terrorist attack
"Updated : November 21, 2015, 10:00 am",Indian scientist appointed to high-level panel on health
"Updated : November 20, 2015, 11:10 pm",CISCE up for revamp to centralise education
"Updated : November 20, 2015, 5:00 pm",Sheen shouldve been upfront about HIV status: McCarthy
"Updated : November 20, 2015, 3:30 pm","Memoir to detail Charlie Sheens career, HIV diagnosis?"
"Updated : November 20, 2015, 9:56 am",Must know: The thin line between AIDS and HIV
"Updated : November 20, 2015, 8:31 am","Chinks in anti-AIDS drive, says NACO"
"Updated : November 19, 2015, 8:30 pm","US has invested USD 100 mn to prevent, control TB in India"
"Updated : November 19, 2015, 8:28 am",Kolkata school to reinstate HIV positive kid
"Updated : November 18, 2015, 9:55 pm","Occupy UGC: Students march to HRD Ministry, detained"
"Updated : November 18, 2015, 7:28 pm",West Bengal: School bars HIV positive child to attend classes
"Updated : November 18, 2015, 3:31 pm",World COPD Day: It's time you get screened for unusual breathing
"Updated : November 18, 2015, 2:05 pm",Finger prick blood tests may be unreliable: study
"Updated : November 18, 2015, 12:14 pm",Charlie Sheen confirms he's HIV positive
"Updated : November 18, 2015, 11:58 am",Charlie Sheen's journey over the years
"Updated : November 18, 2015, 9:36 am",HIV positive boy forced out of school in West Bengal
"Updated : November 18, 2015, 8:15 am",Sheen was different when we got married: Denise Richards
"Updated : November 17, 2015, 8:35 pm",I am HIV positive: Charlie Sheen
"Updated : November 17, 2015, 7:15 pm",I am HIV positive: Charlie Sheen
"Updated : November 17, 2015, 2:20 pm",Jawan dies during training as parachute fails to open
"Updated : November 16, 2015, 5:20 pm",Use coupon code for charity
"Updated : November 16, 2015, 4:20 pm",Urja Global approves Rs 110 cr investment in Chhattisgarh
"Updated : November 13, 2015, 5:15 pm",HIV spreads faster just before violent conflict: study
"Updated : November 10, 2015, 8:40 pm",Repeating after correcting name of foundation in 7th para
"Updated : November 10, 2015, 4:00 pm",Proposed airfare cap on regional routes a holistic move: Ghosh
"Updated : November 10, 2015, 2:50 pm",Proposed airfare cap on regional routes a holistic move: Ghosh
"Updated : November 9, 2015, 6:20 pm",Special Diwali for HIV infected and affected people
"Updated : November 7, 2015, 2:09 pm",Is Hero actor Sooraj Pancholi dating Singh Is Bliing's Amy Jackson?
"Updated : November 6, 2015, 9:20 pm",HRD ministry decides to expand scope of non-NET fellowships
"Updated : November 6, 2015, 1:26 pm",Condom shortage hampers India's fight against AID
"Updated : November 5, 2015, 7:21 pm","Occupy UGC: Students march to HRD min, demand dissolving of"
"Updated : November 5, 2015, 7:21 pm","Occupy UGC: Students march to HRD min, demand dissolving of"
"Updated : November 5, 2015, 7:21 pm","Occupy UGC: Students march to HRD min, demand dissolving of"
"Updated : November 5, 2015, 7:21 pm","Occupy UGC: Students march to HRD min, demand dissolving of"
"Updated : November 5, 2015, 7:21 pm","Occupy UGC: Students march to HRD min, demand dissolving of"
"Updated : November 5, 2015, 7:21 pm","Occupy UGC: Students march to HRD min, demand dissolving of"
"Updated : November 5, 2015, 7:21 pm","Occupy UGC: Students march to HRD min, demand dissolving of"
"Updated : November 5, 2015, 6:42 pm",Centre to improve air connectivity in Raj
"Updated : November 4, 2015, 4:05 pm","If technology is available, India can go beyond INDCS:"
"Updated : November 4, 2015, 4:02 pm",Origin of hepatitis A virus decoded
"Updated : November 3, 2015, 5:28 pm",Work at Indian Maritime University (IMU): Hiring on for Registrar post
"Updated : November 3, 2015, 3:46 pm",We cannot address girls' education crisis until we address broader cultural beliefs: Michelle Obama
"Updated : November 2, 2015, 5:15 pm",Dating apps may increase rates of STIs: experts
"Updated : November 2, 2015, 4:41 pm",Patients want test results via password-protected websites
"Updated : November 2, 2015, 4:13 pm",Highlights of the week (October 26- November 1)
"Updated : November 2, 2015, 3:46 pm",Sania Mirza and Martina Hingis win their ninth title this year: All you need to know
"Updated : November 2, 2015, 11:35 am",China makes male rape a crime amid increasing sexual assaults
"Updated : November 2, 2015, 11:35 am",China makes male rape a crime amid increasing sexual assaults
"Updated : November 2, 2015, 11:32 am",RAPE-HIV 2 LAST
"Updated : November 2, 2015, 11:32 am",RAPE-HIV 2 LAST (BES2)
"Updated : November 2, 2015, 11:31 am",RAPE-HIV 2 LAST
"Updated : November 2, 2015, 11:31 am",RAPE-HIV 2 LAST (BES2)
"Updated : November 2, 2015, 11:28 am",PEP treatment can save rape victim from HIV infection: Experts
"Updated : November 2, 2015, 11:28 am",PEP treatment can save rape victim from HIV infection: Experts
"Updated : November 2, 2015, 11:26 am",(Eds: This is the weekly column by well-known science writer
"Updated : November 2, 2015, 11:26 am",(Eds: This is the weekly column by well-known science writer
"Updated : November 2, 2015, 11:24 am",PEP treatment can save rape victim from HIV infection: Experts
"Updated : November 2, 2015, 11:21 am","SBI chief wants teaser loans back, ICICI Bank differs"
"Updated : November 2, 2015, 11:21 am",Strong moral case for Adani project: Aus Minister
"Updated : November 1, 2015, 2:16 pm","Wood dust, oral contraceptives, sun beds among 116 things that cause cancer"
"Updated : October 31, 2015, 11:14 am",PM Modi calls for global alliance in promoting solar energy to tackle climate change: All you need to know
"Updated : October 30, 2015, 6:45 pm",DRI Mumbai withdraws notice to AIIMS over payment issue
"Updated : October 30, 2015, 5:45 pm",(REOPENS DES18)
"Updated : October 30, 2015, 5:15 pm",We can end AIDS by 2030 in India and Africa: Nadda
"Updated : October 30, 2015, 5:15 pm",AFRICA-HEALTH 2 LAST
"Updated : October 30, 2015, 5:00 pm",NASA releases Earth-like image of Pluto: Some interesting facts that you must know
"Updated : October 30, 2015, 4:57 pm","Atacama Desert, driest place on Earth, turns into pink flower garden: Five unique deserts around the world"
"Updated : October 30, 2015, 3:49 pm",Tuberculosis kills as many people as HIV/AIDS: All you need to know
"Updated : October 30, 2015, 3:04 pm",5 popular tourist attractions you must visit when in Nepal
"Updated : October 29, 2015, 10:40 pm","You probably have herpes, says WHO"
"Updated : October 29, 2015, 9:05 pm",SUMMIT-INVESTMENT 2 LAST
"Updated : October 29, 2015, 8:35 pm",UGC-FELLOWSHIP 2 LAST
"Updated : October 29, 2015, 12:25 pm",India recorded largest number of TB cases in 2014
"Updated : October 29, 2015, 10:20 am",India recorded largest number of TB cases in 2014
"Updated : October 28, 2015, 3:39 pm",Eyecatchers of the week
"Updated : October 27, 2015, 9:55 pm",UGC-PROTEST 2 LAST
"Updated : October 27, 2015, 7:10 pm",Experts urge comprehensive package to fight TB
"Updated : October 27, 2015, 6:32 pm",Doctors to use umbilical cord stem cells to cure HIV in Spain
"Updated : October 27, 2015, 5:45 pm",(Attn.editors: The following press release comes to you under
"Updated : October 27, 2015, 2:15 pm",DATELINE STORY DEL BOM KOL CHN
"Updated : October 26, 2015, 8:25 pm",Non-NET fellowship: Students continue protest despite HRD
"Updated : October 26, 2015, 3:15 pm",SPORT-IND-LD DHONI 3
"Updated : October 25, 2015, 10:46 pm",UGC-LD FELLOWSHIPS 2LAST
"Updated : October 25, 2015, 9:45 pm",Non-NET fellowship not to be discontinued: Irani
"Updated : October 25, 2015, 8:30 pm",Non-NET fellowship not to be discontinued: Irani
"Updated : October 24, 2015, 8:23 am",Hepatitis cases outnumber HIV: Union health ministry report
"Updated : October 22, 2015, 10:05 pm",Students continue protest over scrapping of non-NET fellowship
"Updated : October 22, 2015, 4:55 pm",HIV-infected parcels found in China
"Updated : October 22, 2015, 1:15 pm","HIV+, economically distressed kids taken around"
"Updated : October 21, 2015, 10:20 pm",Students continue protest over scrapping of non-NET fellowship
"Updated : October 20, 2015, 10:50 pm",HIV positive man held in a theft case
"Updated : October 20, 2015, 9:45 pm",Taliban leader Torek Agha designated as global terrorist by US
"Updated : October 20, 2015, 8:20 pm",Students protest against UGC doing away non-Net fellowship
"Updated : October 19, 2015, 5:16 pm","Gays raped, blackmailed by organised gangs and police in India"
"Updated : October 18, 2015, 6:30 pm",Haryana govt gives its nod to Swadhar Greh scheme for women
"Updated : October 18, 2015, 1:25 pm",New low-cost printer tracks HIV patients health
"Updated : October 16, 2015, 7:50 pm","India keen on cooperation with Africa in energy,maritime areas"
"Updated : October 15, 2015, 10:37 pm",Govt vs writers: Writers hit back after Arun Jaitley's barrage
"Updated : October 15, 2015, 3:00 pm",AIRPORT 2 LAST
"Updated : October 13, 2015, 7:45 am",Bryan Singer teasesX-Men: Apocalypse trailer release
"Updated : October 12, 2015, 4:33 pm",International Day of the Girl Child: UN Secretary-General Ban Ki-moon advises to give opportunities to all girls
"Updated : October 12, 2015, 12:58 pm","Not just Ruskin Bond,Stephen Fry Jaipur Lit Fest to also feature Malian musician Fatoumata Diawara"
"Updated : October 11, 2015, 7:55 pm","Gold worth Rs 62 lakh seized, woman arrested at Jaipur airport"
"Updated : October 11, 2015, 12:45 pm","1,433 people died of infectious disease in China: report"
"Updated : October 11, 2015, 11:45 am",Militant killed in overnight encounter
"Updated : October 11, 2015, 11:31 am",Nepal's parliament to choose new prime minister today
"Updated : October 10, 2015, 8:05 pm","India risks backsliding on success against HIV, says UN envoy"
"Updated : October 10, 2015, 11:50 am",VITEEE 2016: Check the syllabus at vit.ac.in
"Updated : October 9, 2015, 6:37 pm",Singh Is Bliing box office collection: Here's how much Akshay Kumar's film has earned in a week
"Updated : October 9, 2015, 3:31 pm","Black magic, sex, toilets, brains: 6 unusual museums in India"
"Updated : October 9, 2015, 2:15 pm",Vaginal bacteria could protect women from HIV
"Updated : October 8, 2015, 11:55 pm",One held for duping man of Rs 16 lakh
"Updated : October 8, 2015, 11:45 pm",One held for duping man of Rs 16 lakh
"Updated : October 8, 2015, 4:22 pm",Straight from the heart
"Updated : October 7, 2015, 10:47 pm",Shiv Sena sinks Ghulam Ali's concerts
"Updated : October 6, 2015, 7:07 pm",Singh Is Bliing box office collection: Akshay Kumar's film slows down on first Monday
"Updated : October 6, 2015, 6:21 pm",Singh Is Bliing box office collection: It's a Rs 50-crore weekend for Akshay's film
"Updated : October 6, 2015, 3:50 pm",Birthday special: Tom Hanks' top 10 'must watch' movies
"Updated : October 4, 2015, 4:15 pm",Lara Dutta warns fans against fake Facebook account
"Updated : October 4, 2015, 1:15 pm",80-yr-old NRI in UK to walk from Kanyakumari to Delhi
"Updated : October 4, 2015, 1:05 pm",DSACS distributes 1.68 lakh condoms free of cost in G B Road
"Updated : October 4, 2015, 11:35 am",Delhi asks Centre to continue ban on Chinese firecrackers
"Updated : October 3, 2015, 5:25 pm",Nursing student commits suicide
"Updated : October 3, 2015, 5:25 pm",Nursing student commits suicide
"Updated : October 3, 2015, 5:04 pm",DIY: Perfect your half-bun like Alia Bhatt and Amy Jackson
"Updated : October 3, 2015, 3:20 pm",Singh Is Bliing movie review: A bling-bling joyride from Akshay Kumar and Amy Jackson
"Updated : October 3, 2015, 2:30 pm",China makes HIV/AIDS prevention 1st lesson in Beijing colleges
"Updated : October 3, 2015, 2:30 pm",China makes HIV/AIDS prevention 1st lesson in Beijing colleges
"Updated : October 3, 2015, 9:30 am",Singh Is Bliing: Akshay Kumar and Amy Jackson teach you how to bliing it right at this screening
"Updated : October 2, 2015, 10:36 pm",Nepal PM Sushil Koirala to resign shortly
"Updated : October 2, 2015, 3:25 pm",I work much better on films during difficult times: Salman
"Updated : October 2, 2015, 10:15 am",Review: Singh is Bliing- Comedy as a poor joke
"Updated : October 1, 2015, 1:30 pm",TRAI stands by its proposal of making GPS mandatory in all phones
"Updated : September 30, 2015, 8:35 pm",Court concludes hearing on parents plea in Junagadh HIV case
"Updated : September 30, 2015, 5:15 pm",TRAI sticks to its guns on GPS in all handsets
"Updated : September 29, 2015, 4:45 pm",Molecule key to shock-and-kill strategy against HIV
"Updated : September 29, 2015, 12:15 pm",MONITOR 2LAST
"Updated : September 29, 2015, 11:15 am",MONITOR 2LAST
"Updated : September 28, 2015, 8:55 pm",Bill Gates drops by during Modi-Hollande meeting
"Updated : September 28, 2015, 5:30 pm",Who's the Boss? star Danny Pintauro reveals he is HIV positive
"Updated : September 28, 2015, 4:31 pm","DIY: Amy Jackson's perfect eyebrows, and how you can get the look"
"Updated : September 28, 2015, 4:05 pm",Singh Is Bliing my dream role: Amy Jackson
"Updated : September 28, 2015, 11:04 am",Aditi Rao Hydari and Deepika Padukone look eerily similar on the red carpet
"Updated : September 28, 2015, 10:45 am",Whos the Boss? star Danny Pintauro says hes HIV positive
"Updated : September 27, 2015, 2:05 pm",UN launches strategy to end preventable deaths of mothers
"Updated : September 26, 2015, 11:45 am",Alan Cumming to star in dark comedy Florent
"Updated : September 25, 2015, 10:35 pm",Generic drugs: NGOs ask India not to buckle under US pressure
"Updated : September 25, 2015, 1:25 pm",Maggie Gyllenhaal to star in HBO drama The Deuce
"Updated : September 24, 2015, 6:05 pm",NGO supplies one lakh condoms to DSACS and NACO
"Updated : September 24, 2015, 4:05 pm",New technology may replace GPS to track athlete performance
"Updated : September 24, 2015, 9:45 am",(Attn.editors: The following press release comes to you under
"Updated : September 23, 2015, 9:15 pm",Delhi Govt orders procurement of 4 lakh condoms for G B Road
"Updated : September 23, 2015, 8:45 pm",Kuoni hopes to log in profit this year despite rupee fall
"Updated : September 23, 2015, 8:35 pm",Kuoni hopes to log in profit this year despite rupee fall
"Updated : September 22, 2015, 9:35 pm","- The Sun Dial- This is a 1600 square feet image in tile,"
"Updated : September 22, 2015, 7:45 pm",DELHI-REPORT 2 LAST
"Updated : September 21, 2015, 5:27 pm",Kamal Haasan to endorse textile showroom brand Pothys
"Updated : September 21, 2015, 4:33 pm","Kareena Kapoor is my inspiration, says Amy Jackson"
"Updated : September 21, 2015, 4:33 pm",Amy Jackson says she was very nervous to work with Akshay Kumar
"Updated : September 21, 2015, 4:27 pm",I look up to Lara Dutta for inspiration: Amy Jackson
"Updated : September 21, 2015, 4:25 pm",Learning Tamil was difficult but was worth it: Amy Jackson
"Updated : September 21, 2015, 12:22 pm",Singh Is Bliing: Akshay Kumar will tickle your funny bone with his dialogues in the film
"Updated : September 20, 2015, 12:15 am",Himachal University entrusted the work to conduct NFHS
"Updated : September 19, 2015, 9:03 pm","I was very nervous working with Akshay Kumar, says Amy Jackson"
"Updated : September 18, 2015, 8:36 am",Proper hydration can help treat dengue patients
"Updated : September 17, 2015, 3:35 pm",Cant disclose quantity of gold lying in vaults: Customs
"Updated : September 17, 2015, 12:45 pm",Natural defence against HIV discovered
"Updated : September 16, 2015, 3:57 pm",Singh Is Bliing: Watch Akshay and Amy in the song Mahi Aaja
"Updated : September 16, 2015, 3:15 pm",Skin microbes could fight common STDs
"Updated : September 14, 2015, 9:15 pm","Nearly 27,000 HIV positive cases detected in Thane, Palghar"
"Updated : September 14, 2015, 7:05 pm",MINDTREE 3
"Updated : September 14, 2015, 6:09 pm",Lab-on-a-chip device to cut health tests costs
"Updated : September 13, 2015, 6:15 pm",New lab-on-chip device to cut health test costs
"Updated : September 13, 2015, 3:45 pm",Will set up skin bank using collection of MSG sequel: Gurmeet
"Updated : September 13, 2015, 11:45 am",GPS to be installed in rented bikes in city
"Updated : September 11, 2015, 10:32 am",ICFAI University admissions 2015: Apply for distance MBA programmes
"Updated : September 9, 2015, 11:35 pm",Dr Reddys signs pact with US firm
"Updated : September 9, 2015, 5:35 pm",NUTRITION 2 LAST
"Updated : September 9, 2015, 5:35 pm",Attn.editors: The following press release comes to you under
"Updated : September 9, 2015, 3:20 pm",UN-IBSA 2 LAST
"Updated : September 7, 2015, 8:25 pm",DCW urges Delhi govt to approve Victim Compensation Scheme
"Updated : September 7, 2015, 4:20 pm",HIV pill protects 100 per cent of participants in study
"Updated : September 4, 2015, 5:50 pm",New rapid TB tests could reduce mortality
"Updated : September 4, 2015, 4:46 pm",Philadelphia: Yet another award for Tom Hanks after 22 years
"Updated : September 4, 2015, 3:50 pm",Many Indian doctors under pressure to meet revenue targets
"Updated : September 2, 2015, 9:00 pm",British clinic accidentally leaks HIV status of 780 patients
"Updated : August 30, 2015, 8:04 pm",Every Nepal-India boundary pillar to have GPS observation
"Updated : August 24, 2015, 10:42 am",The art of ageing: Seven achievers tell us why it's never too late
"Updated : August 21, 2015, 3:41 pm","Singh is Bliing: Don't want to show anything that would hurt religious sentiments, says Akshay Kumar"
"Updated : August 19, 2015, 11:37 am",US approves female Viagra with strong warning
"Updated : August 13, 2015, 7:04 pm",Upcoming version of iOS and OS X to support flight tracking
"Updated : August 11, 2015, 1:42 pm",ICFAI Business School Aptitude Test 2015: Registrations begin
"Updated : August 10, 2015, 11:43 am",IIM study finds flaws in health care facility of BIMARU states
"Updated : August 10, 2015, 10:59 am",Lucknow's bloodthirsty doctor couple exploited children from poor families
"Updated : August 5, 2015, 5:15 pm",Government mulls providing over 50 essential drugs at cheaper rates
"Updated : August 5, 2015, 4:24 pm",PGI Chandigarh throws biomedical waste on PMO orders
"Updated : August 5, 2015, 1:59 pm",ICFAI Business School Aptitude Test 2015: Important information
"Updated : August 3, 2015, 6:39 pm",Monsoon hacks: Keep these common ailments at bay
"Updated : August 1, 2015, 9:17 am",Bio-medical waste raises healthcare stink in New Delhi
"Updated : July 31, 2015, 10:58 am",Google will tell you if your favorite store is crowded or not
"Updated : July 28, 2015, 5:32 pm",Groundbreaking HIV researcher Dr Suniti Solomon passes away
"Updated : July 28, 2015, 10:54 am",IBSAT 2015 exam dates announced by the ICFAI Foundation for higher education
"Updated : July 24, 2015, 6:58 pm","Funding crisis puts India's AIDS programme, and lives, at risk"
"Updated : July 23, 2015, 4:15 pm",Google Map's scarily amazing feature knows what all places you have visited
"Updated : July 23, 2015, 10:43 am",Kerala government makes AIDS awareness compulsory for school students
"Updated : July 21, 2015, 10:22 am",Doctors say teen's HIV in check for 12 years without drugs
"Updated : July 15, 2015, 11:24 am",Sending Google Maps directions from desktop to mobile now easier
"Updated : July 10, 2015, 10:32 pm",Prenatal cocaine exposure linked to starting sex early
"Updated : July 9, 2015, 6:36 pm",Labour of love
"Updated : July 9, 2015, 1:09 pm",A newly found drug compound could shrink HIV strength
"Updated : July 2, 2015, 9:06 pm",No shooter found at US Navy Yard in Washington
"Updated : July 2, 2015, 2:33 pm",World UFO Day: Everything you need to know about UFOs and their sightings
"Updated : July 2, 2015, 2:33 pm",Celebrities turned Politicians: List of 10 well-known celebrities who joined politics
"Updated : July 2, 2015, 2:19 pm",Digital India Week: Facts you must know about it
"Updated : July 2, 2015, 1:57 pm","Delhi gangrape case: Danish woman appears in court, identifies accused"
