"Updated : March 27, 2018, 4:10 pm",EWS admissions: Delhi govt warns pvt schools against asking for Aadhaar
"Updated : March 27, 2018, 7:35 am","Family claims Rs 6 crore from Fernandez hospital, Aarohi blood bank after infant gets HIV"
"Updated : March 26, 2018, 3:55 pm",Yogi government completes a year: A look at some initiatives taken by the administration
"Updated : March 26, 2018, 12:34 pm",What are the symptoms of tuberculosis and how can you prevent it?
"Updated : March 26, 2018, 6:19 am",RML Hospital doctors fume over limit on prescribing tests
"Updated : March 25, 2018, 11:40 am","Metropolis Healthcare plans to add 800 centres, 10 labs by FY19-end"
"Updated : March 24, 2018, 11:10 am",Trump orders ban on most transgenders from serving in US military
"Updated : March 23, 2018, 10:10 pm",WHO urges countries to invest more in research to prevent TB transmission
"Updated : March 22, 2018, 3:40 pm","HIV prevalence rate third highest in Nagaland, highest in"
"Updated : March 22, 2018, 3:10 pm","HIV prevalence rate third highest in Nagaland, highest in"
"Updated : March 20, 2018, 3:33 pm",World Oral Health Day: 6 ways your tongue is warning you about your health
"Updated : March 19, 2018, 6:00 am",AIIMS docs pitch for viral marker tests to determine if any patient has any existing infection
"Updated : March 15, 2018, 10:10 am",Progress against TB in SE Asian region to have major impact globally: WHO Chief
"Updated : March 14, 2018, 10:10 pm",Progress against TB in SE Asian region to have major impact globally: WHO Chief
"Updated : March 14, 2018, 9:40 pm",Progress against TB in SE Asian region to have major impact globally: WHO Chief
"Updated : March 14, 2018, 4:49 pm",Strides Shasun gets USFDA nod for HIV treatment drug
"Updated : March 14, 2018, 9:14 am",Modi calls for change in approach to eliminate TB; announces target to free India of the disease by 2025
"Updated : March 14, 2018, 3:06 am",World can win war against TB if battle won in India: WHO
"Updated : March 13, 2018, 11:08 am",Health bodies push for compulsory licence for two drugs on MDR-TB
"Updated : March 12, 2018, 11:39 am",5 undertrials in Muzaffarnagar jail test positive for HIV
"Updated : March 8, 2018, 5:56 pm",Aditi Rao Hydari to Ramya Krishnan: Tamil heroines who ruled the roost in 2017
"Updated : March 8, 2018, 11:35 am","UP jail HIV case: NHRC sends notice to govt, seeks report"
"Updated : March 8, 2018, 11:35 am",NHRC seeks report on prisoners found HIV positive in
"Updated : March 7, 2018, 7:54 pm",EWS admission: Computerised draw postponed due to technical reasons
"Updated : March 5, 2018, 6:26 pm",Novel antibody suppresses HIV in monkeys: study
"Updated : March 3, 2018, 5:49 pm",Immune-suppression must while planning for smallpox outbreak
"Updated : March 2, 2018, 6:09 pm","Prince Harry, Meghan Markle to invite members of public to royal wedding"
"Updated : February 28, 2018, 4:07 pm",NIA to probe human trafficking cases
"Updated : February 28, 2018, 4:21 am",UP: 23 inmates of Gorakhpur jail test HIV positive
"Updated : February 28, 2018, 2:15 am",23 inmates of Gorakhpur jail test HIV positive
"Updated : February 27, 2018, 8:36 pm",Cabinet to examine if NIA can probe human trafficking
"Updated : February 27, 2018, 8:36 pm",Cabinet to examine if NIA can probe human trafficking
"Updated : February 27, 2018, 4:59 pm",Hetero launches HIV treatment drug in India
"Updated : February 27, 2018, 5:10 am",Nadda launches initiative for free viral load test for people living with HIV/AIDS
"Updated : February 26, 2018, 2:39 pm","BD appoints Pavan Mocherla as MD for India, South Asia"
"Updated : February 24, 2018, 5:50 pm","WHO recommends scaling up access to testing, treatment for TB"
"Updated : February 21, 2018, 9:04 pm","Digital health can reduce inequity, medical errors: Nadda"
"Updated : February 21, 2018, 3:39 pm",New AI system may help check TB spread in India
"Updated : February 18, 2018, 3:16 pm",Metropolis Healthcare plans Rs 100-cr expansion
"Updated : February 18, 2018, 2:39 pm",Metropolis Healthcare plans Rs 100-cr expansion
"Updated : February 14, 2018, 2:30 am",AHF observes International Condom Day
"Updated : February 13, 2018, 4:00 pm",Modicare: Will it work?
"Updated : February 12, 2018, 11:13 pm",Anti-trafficking Bill likely to be tabled in Parl nxt month
"Updated : February 8, 2018, 10:28 pm",Quack accused of infecting scores with HIV in Unnao held: Cops
"Updated : February 8, 2018, 3:12 pm",46 infected with HIV in UPs Unnao as quack injects medicine
"Updated : February 8, 2018, 2:27 pm","46 infected with HIV, says Unnao CMO; quack who used same"
"Updated : February 8, 2018, 2:04 pm",PTI HIGHLIGHTS AT 9-30 PM
"Updated : February 8, 2018, 12:42 pm","HIV incident: Ex-IMA chief says it is a criminal act, Centre"
"Updated : February 8, 2018, 11:44 am","46 infected with HIV, says Unnao CMO; quack who used common"
"Updated : February 8, 2018, 10:09 am",PTI HIGHLIGHTS AT 5 PM
"Updated : February 8, 2018, 9:08 am",46 infected with HIV as quack uses common syringe: CMO
"Updated : February 8, 2018, 4:16 am",21 become HIV infected as Unnao quack uses common syringe: CMO
"Updated : February 7, 2018, 6:22 pm","Chennai air turns unhealthy, activists say Centre should look beyond Delhi"
"Updated : February 6, 2018, 11:24 pm",Uttar Pradesh: 46 infected with HIV at Unnao health camp after quack uses same syringe
"Updated : February 6, 2018, 3:49 pm",40 people test HIV positive in UP's Unnao after quack uses same syringe on them
"Updated : February 4, 2018, 4:10 pm",Research claims lack of access to essential medicines in India
"Updated : February 4, 2018, 3:40 pm",Research claims lack of access to essential medicines in India
"Updated : February 2, 2018, 1:40 pm",New paper-based test to detect HIV early
"Updated : February 1, 2018, 11:04 am","10 amazing facts about DNA, the fundamental unit that makes life possible on Earth"
"Updated : January 29, 2018, 12:10 pm",Cipla gets USFDA approval for HIV drug
"Updated : January 29, 2018, 12:10 pm",Strides Shasun arm gets USFDA nod for HIV drug
"Updated : January 28, 2018, 1:10 pm",Seven bacterial species may up HIV risk in women: study
"Updated : January 28, 2018, 12:40 pm",Call Me by Your Name dir to tackle HIV and AIDS in sequel
"Updated : January 25, 2018, 10:49 am","12 interesting facts about Ruskin Bond, the Indian William Wordsworth"
"Updated : January 21, 2018, 11:10 am",PM asks CMs to address challenge of TB in mission mode
"Updated : January 19, 2018, 4:40 pm",Safe pregnancy has become a social movement in India: Nadda
"Updated : January 18, 2018, 12:30 pm","Arun Prabu to Lokesh Kanagaraj, promising Tamil debut directors of 2017"
"Updated : January 16, 2018, 5:09 pm",Aruvi full movie leaked online: Aditi Balan film reaches Facebook
"Updated : January 13, 2018, 3:45 pm",Venus-like planet discovered around dim star
"Updated : January 13, 2018, 3:45 pm","Remembering George Everest, the man who gave his name to the highest mountain on Earth"
"Updated : January 13, 2018, 3:45 pm",Remembering Nelson Mandela: Facts about the freedom activist who became the first black President of South Africa
"Updated : January 13, 2018, 3:45 pm",World Blood Donor Day: 13 myths and 12 facts to get rid of your hesitation towards blood donation
"Updated : January 13, 2018, 3:45 pm","The name's Bond, Ruskin Bond: 5 life lessons you should learn from the prolific writer"
"Updated : January 13, 2018, 3:45 pm",5 popular books by Ruskin Bond you shouldn't miss
"Updated : January 13, 2018, 3:45 pm",Remembering Ronald Ross and 6 other great scientists who have won the Nobel Prize for discovering lifesaving medicine
"Updated : January 13, 2018, 3:45 pm","Happy Birthday, Tom Cruise! Facts about the Mission Impossible star who is turning 55"
"Updated : January 13, 2018, 3:45 pm","Karnataka calling: IT done, the state should now transform its agriculture"
"Updated : January 13, 2018, 3:45 pm",Rising Rajasthan: The success story of a former BIMARU state
"Updated : January 13, 2018, 2:50 am",Doctors talk about how AIDS patients can live a normal life
"Updated : January 13, 2018, 2:50 am","On World AIDS Day, let us talk about how we treat HIV positive patients"
"Updated : January 13, 2018, 2:50 am",World Aids Day: How to identify Aids in the early stages
"Updated : January 13, 2018, 2:50 am","AIDS/HIV can also result in infertility, says study"
"Updated : January 13, 2018, 2:50 am","World AIDS Day 2017: New infection cases in India almost halved over the past decade, still a long road to go"
"Updated : January 13, 2018, 2:50 am","Bigg Boss 11: Salman Khan wants Bipasha Basu, Karan Singh Grover's condom ad removed?"
"Updated : January 13, 2018, 2:50 am","In a first, WHO releases child sex abuse guidelines"
"Updated : January 13, 2018, 2:50 am",From anger to pride: Kolkata's evolution of embracing gay rights
"Updated : January 12, 2018, 1:48 pm","India, US working together to fight TB, dengue: US envoy"
"Updated : January 12, 2018, 12:52 pm",Shahrukh Khan to get Crystal Award at WEF Davos Summit
"Updated : January 11, 2018, 5:13 pm",Star-shaped capsule can simplify the treatment for HIV: All you need to know about it
"Updated : January 11, 2018, 3:18 pm",Sponsor Muskan's education
"Updated : January 11, 2018, 3:18 pm",Hrithik supports wife's cause
"Updated : January 11, 2018, 3:18 pm",Hrithik supports wife's cause
"Updated : January 11, 2018, 6:41 am","Nursery admissions under EWS, DG categories from Jan 22"
"Updated : January 11, 2018, 6:41 am",Once-a-week pill for HIV treatment developed
"Updated : January 7, 2018, 2:35 pm","Those who underwent surgery, transfusion before 2002 to be"
"Updated : January 5, 2018, 5:05 pm",Common birth control drug may up HIV risk: study
"Updated : December 31, 2017, 2:07 pm",Gurgaon Fortis Hospital accused of selling fresh frozen plasma to Reliance
"Updated : December 29, 2017, 8:15 pm","Canada to Switzerland, these are the 12 best countries to live in"
"Updated : December 24, 2017, 11:15 am",Policy bodies praise govts clarification on condom ads
"Updated : December 20, 2017, 7:35 pm",HC notice to Centre over curb on condom ads on TV
"Updated : December 20, 2017, 5:51 pm",Department of Education to introduce transgender issues in sex education classes
"Updated : December 20, 2017, 4:55 pm",HC notice to Centre over curb on condom ads on TV
"Updated : December 19, 2017, 4:30 pm",Designer gold nanoparticles could combat deadly viruses
"Updated : December 19, 2017, 1:24 pm",Filmmaker Lakshmy Ramakrishnan upset with Aruvi for mocking her show
"Updated : December 17, 2017, 5:10 pm",Ban on condom ads on TV would undo decades of progress
"Updated : December 15, 2017, 9:25 pm",ASCI welcomes advisory on condom ads on TV channels
"Updated : December 15, 2017, 6:55 pm",ASCI welcomes ban on condom ads on TV channels
"Updated : December 14, 2017, 8:30 pm",SC to pronounce order on mandatory linking of Aadhaar tomorrow
"Updated : December 10, 2017, 12:05 pm",Charlie Sheen sues National Enquirer over rape allegations
"Updated : December 9, 2017, 5:00 pm",Coordinated efforts needed to curb drug trafficking: Ex-
"Updated : December 7, 2017, 9:50 pm",Take stringent action against diagnostic centre: DMC to DGHS
"Updated : December 5, 2017, 2:45 pm",Manipur: sexual relation now main reason for HIV transmission
"Updated : December 5, 2017, 1:50 pm",Manipur: sexual relation now main reason for HIV transmission
"Updated : December 5, 2017, 1:10 pm",Manipur: HIV transmission shifts from syringe to sexual route
"Updated : December 5, 2017, 12:55 pm",Manipur: HIV transmission shifts from syringe to sexual route
"Updated : December 4, 2017, 4:20 pm",New way to stop HIV in its tracks found
"Updated : December 1, 2017, 10:10 pm",NORTHERN REGION HIGHLIGHTS 2130 HRS
"Updated : December 1, 2017, 8:45 pm",Prince Harry makes first joint visit with fiance Meghan Markle
"Updated : December 1, 2017, 8:10 pm",World AIDS Day observed in jail premises to educate inmates
"Updated : December 1, 2017, 5:30 pm",HIV directly impacts brain in early stages: study
"Updated : December 1, 2017, 4:25 pm",Anupriya Patel launches plan for eradicating HIV/AIDS by 2030
"Updated : December 1, 2017, 2:15 pm",CM asks industries to employ HIV/AIDS persons
"Updated : December 1, 2017, 11:15 am",HIV taught us how to improve our health systems: Expert
"Updated : December 1, 2017, 10:55 am",HIV taught us how to improve our health systems: Expert
"Updated : December 1, 2017, 12:00 am",HIV has taught us how to improve our health systems: Expert
"Updated : November 30, 2017, 10:20 pm",Exhibition on milestones of fight against AIDS in India
"Updated : November 30, 2017, 6:25 pm",MP: Number of new HIV cases in transgender community rises
"Updated : November 30, 2017, 6:10 pm",MP: Number of new HIV cases in transgender community rises
"Updated : November 30, 2017, 2:25 pm",Cipla gets WHO nod to sell TB preventing drug in HIV patients
"Updated : November 28, 2017, 6:10 pm",Microorganisms found from Atacama Desert may cure HIV
"Updated : November 26, 2017, 9:25 pm",NORTHERN REGION HIGHLIGHTS 2100 HRS
"Updated : November 26, 2017, 9:25 pm",NORTHERN REGION HIGHLIGHTS 2100 HRS (CORRECTED)
"Updated : November 26, 2017, 6:00 pm",NORTHERN REGION HIGHLIGHTS 1730 HRS
"Updated : November 26, 2017, 12:10 pm",Soumya Swaminathan to take charge as WHO Deputy DG in Dec
"Updated : November 23, 2017, 8:40 pm",HIV/AIDS prevalence rate reducing in Nagaland
"Updated : November 23, 2017, 8:10 pm",HIV/AIDS prevalence rate reducing in Nagaland
"Updated : November 21, 2017, 7:00 am",S African Indian-origin AIDS researcher appointed UNAIDS
"Updated : November 19, 2017, 5:05 pm",Global health experts ask govts to fund research for combating
"Updated : November 18, 2017, 4:40 pm","114 countries launch urgent action to end TB by 2030, says WHO"
"Updated : November 16, 2017, 3:45 pm","14,632 HIV positives identified in Mizoram"
"Updated : November 14, 2017, 8:55 pm",Hetero gets DCGI nod to market anti-retroviral FDC tablets
"Updated : November 13, 2017, 2:00 pm",How HIV spreads through the body decoded
"Updated : November 7, 2017, 12:40 pm","Harvard honours Elton John for efforts for fighting HIV, AIDS"
"Updated : October 31, 2017, 3:48 pm",Tuberculosis claimed over 4 lakh lives in India last year; where are we headed?
"Updated : October 31, 2017, 1:40 pm",HC seeks to know if insurance cover given to AIDS/HIV patients
"Updated : October 30, 2017, 11:50 pm",India tops list of new TB cases in 2016: WHO
"Updated : October 29, 2017, 1:45 pm",Experimental vaccine may protect against HIV
"Updated : October 26, 2017, 8:10 pm",Fake stamp paper scam convict Telgi dies
"Updated : October 26, 2017, 5:05 pm",Indian-origin South African couple receives top US award for AIDS research
"Updated : October 25, 2017, 5:15 pm",Top US award for S African Indian-origin AIDS researchers
"Updated : October 25, 2017, 3:35 pm",Chhattisgarh women SHGs get Rs 67 crore as business loans
"Updated : October 23, 2017, 3:58 pm",WATCH: Bipasha Basu and Karan Singh Grover spice it up in the bedroom for condom ad
"Updated : October 18, 2017, 4:55 pm",Gandhi museum inaugurated in Durban on land owned by Mahatma
"Updated : October 17, 2017, 6:50 pm",S Africa proud of its association with India: Zulu King
"Updated : October 17, 2017, 6:50 pm",Health ministry employees take pledge on road safety
"Updated : October 16, 2017, 2:10 pm",Here's why new moms are eating their placenta
"Updated : October 16, 2017, 11:54 am",Yuvraj Singh new ambassador for Mercedes Benz India supported Laureus
"Updated : October 15, 2017, 2:45 pm","Not man, not woman, we are transgenders: Gauri Sawant"
"Updated : October 9, 2017, 11:25 pm",Harsh Vardhan suggests areas to collaborate with SAfrica
"Updated : October 6, 2017, 5:20 pm",Preventing transmission of HIV from mother to child a
"Updated : October 6, 2017, 5:05 pm",Preventing transmission of HIV from mother to child a
"Updated : October 6, 2017, 1:30 pm",New molecule could kick and kill HIV
"Updated : October 4, 2017, 12:08 pm",Soumya Swaminathan appointed Deputy Director-General of WHO: All you should know about her
"Updated : September 29, 2017, 9:20 pm",Money generated from sale of Vespa RED to be used to fight
"Updated : September 29, 2017, 4:50 pm","When 300 transgender and hijra entrepreneurs, artists and activists gathered at a Delhi mall"
"Updated : September 29, 2017, 3:15 pm",New smartphone-based test can detect HIV in seconds
"Updated : September 27, 2017, 8:50 pm","India, US renew commitment to collaborate on health sector"
"Updated : September 27, 2017, 1:05 pm",STD cases surge to record high in US: report
"Updated : September 25, 2017, 12:06 pm",FACT CHECK: Can shaking hands and using same mobile devices cause AIDS?
"Updated : September 21, 2017, 6:20 pm",Bangladesh to provide birth control kits to Rohingya refugees
"Updated : September 19, 2017, 8:42 pm",18 people infected by HIV due to blood transmission in Mumbai in 2016-17
"Updated : September 19, 2017, 7:05 pm",18 got HIV due to blood transmission in Mumbai in 2016-17
"Updated : September 19, 2017, 6:35 pm",Rostec inks pact with Mylan Lab for HIV drugs
"Updated : September 19, 2017, 2:35 pm",Smokers with HIV more at risk of lung cancer than AIDS: study
"Updated : September 18, 2017, 1:36 pm",Here's how men in their 50s go through a certain type of menopause
"Updated : September 15, 2017, 8:50 pm",Kerala HIV positive girl: Medical team begins probe
"Updated : September 15, 2017, 1:25 pm",Girl found HIV positive after transfusion: Govt orders probe
"Updated : September 14, 2017, 7:50 pm",9-year-old cancer patient found HIV+ after blood transfusion
"Updated : September 13, 2017, 6:20 pm",India lags behind in meeting UNs 2030 health target: Lancet
"Updated : September 10, 2017, 7:10 pm",Single window system for HIV infected in Chhattisgarh
"Updated : September 10, 2017, 6:55 pm",Single window system for HIV infected in Chhattisgarh
"Updated : September 10, 2017, 11:59 am",How this HIV+ bodybuilder is taking the world of sports by storm
"Updated : September 10, 2017, 9:25 am",Broadway composer-lyricist Michael Friedman dead
"Updated : September 8, 2017, 6:40 pm",Refusal to treat HIV+ woman: Notices to 10 hospital staffers
"Updated : September 8, 2017, 4:40 pm",Urgent action needed to eliminate hepatitis: Amitabh Bachchan
"Updated : September 7, 2017, 9:20 pm",MP: Husband alleges HIV+ pregnant woman denied treatment
"Updated : September 7, 2017, 7:40 pm",TOP STORIES AT 1930 HRS
"Updated : September 7, 2017, 5:45 pm",NHRC notice to MP govt over refusal to treat HIV+ woman
"Updated : September 6, 2017, 7:35 pm",WHO Southeast Asia health ministers meet starts in Maldives
"Updated : September 5, 2017, 7:15 pm",HC seeks AAP govt report on plea for free treatment of Hep C
"Updated : September 4, 2017, 7:45 pm",BRICS nations commit to enhance cooperation on health matters
"Updated : August 31, 2017, 5:00 pm",UK pays tributes to Diana on 20th death anniversary
"Updated : August 31, 2017, 4:35 pm",Tick saliva drug may lower HIV-linked heart disease risk
"Updated : August 29, 2017, 9:05 pm",IIM-A develops matrimonial website for HIV positive people
"Updated : August 28, 2017, 10:35 pm",Indian-American helps with life saving medication during storm
"Updated : August 24, 2017, 9:15 pm","No one likes to be told what to eat, how to dress: SC"
"Updated : August 24, 2017, 2:25 pm",How Pradipkumar shed HIV tag to become champion bodybuilder!
"Updated : August 24, 2017, 1:25 pm",More effective way to treat HIV identified
"Updated : August 23, 2017, 1:20 pm","Self-powered, paper-based device can detect diseases"
"Updated : August 21, 2017, 12:45 pm",Aurobindo Pharma gets USFDA nod for anti-HIV drug
"Updated : August 19, 2017, 12:10 pm",Novel approach to track HIV infection found
"Updated : August 17, 2017, 1:05 pm",Pay Rs 10L compensation to destitute rape victim: SC to Bihar
"Updated : August 16, 2017, 6:35 pm",JKSACS runs campaign against drug addition
"Updated : August 9, 2017, 10:45 pm","HC raps Centre, Delhi govt for not helping HIV+ man"
"Updated : August 8, 2017, 6:05 pm",Zydus Cadila gets USFDA nod to market HIV drug
"Updated : August 8, 2017, 2:20 pm",Mylan gets DCGI nod to launch HIV drug in India
"Updated : August 1, 2017, 6:20 pm","Govt buys equipment worth Rs 2.38L cr in 3 yrs, Rs 1.52 cr"
"Updated : July 28, 2017, 8:10 pm",Efforts to eliminate hepatitis gaining momentum: WHO
"Updated : July 28, 2017, 4:11 pm",World Hepatitis Day: 5 ways this liver disease is transmitted
"Updated : July 27, 2017, 5:50 pm","WHO urges action for eliminating hepatitis in India, SE Asia"
"Updated : July 26, 2017, 11:15 pm","Spurt in cases of diarrhoea, diabetes in Delhi: NGO data"
"Updated : July 26, 2017, 2:48 pm",Major breakthrough in medicine world: Human antibodies produced in a lab for first time
"Updated : July 25, 2017, 2:45 pm",New HIV vaccine shows promise in human trials
"Updated : July 25, 2017, 12:10 pm",Human antibodies produced in lab for first time
"Updated : July 24, 2017, 6:05 pm",Saliva analysis hints at ghost human species
"Updated : July 24, 2017, 5:58 pm",Rs 200 notes to be launched to fill the 'missing middle': SBI report
"Updated : July 24, 2017, 3:18 pm",History's oldest emoji found in Turkey and it dates back to 3700 years
"Updated : July 24, 2017, 2:53 pm","India skips key WHO policies to tackle TB, continues to report highest cases in world"
"Updated : July 24, 2017, 1:45 pm","Ex-ISRO Chief UR Rao passes away at 85: About the man behind India's first satellite, Aryabhata"
"Updated : July 24, 2017, 1:41 pm",Scientists discover 'angel particle' that is both matter and anti-matter
"Updated : July 24, 2017, 1:39 pm",Total solar eclipse on August 21: NASA issues safety tips to watch spectacle
"Updated : July 23, 2017, 9:05 am","Infected, not recovering? Blame it on the tandoori chicken!"
"Updated : July 22, 2017, 5:49 pm",Cow antibodies may help develop HIV vaccines
"Updated : July 21, 2017, 7:20 pm",TOP STORIES AT 1915 HRS
"Updated : July 21, 2017, 2:05 pm","India, China, Pak among 10 nations accounting for 95% of HIV"
"Updated : July 21, 2017, 11:45 am","India, China, Pak among 10 nations accounting for 95% of HIV"
"Updated : July 19, 2017, 9:30 pm",32 thalassemia-hit kids contracting HIV: Case closed
"Updated : July 14, 2017, 3:50 pm",China to have special courses on sexual education
"Updated : July 11, 2017, 6:25 pm",Struggling AIIMS bone bank gets boost with new donor
"Updated : July 11, 2017, 6:00 pm","AIIMS bone bank gets bones, skin from donor"
"Updated : July 9, 2017, 2:55 pm",Antibiotic resistance making gonorrhoea treatment harder: WHO
"Updated : July 5, 2017, 11:50 pm",WHO recommended nine mnth MDR TB treatment regime not included
"Updated : July 1, 2017, 7:45 pm",NPPA fixes ceiling prices of 814 scheduled formulations
"Updated : June 30, 2017, 11:10 pm",Govt will ensure patients dont pay more for drugs post GST
"Updated : June 30, 2017, 3:55 pm",No price change in 78% of actively used drugs post GST: NPPA
"Updated : June 30, 2017, 2:45 pm",Trump nominates Adams in place of Murthy as US Surgeon General
"Updated : June 28, 2017, 11:30 pm",HIV patient seeks nod for euthanasia
"Updated : June 27, 2017, 7:40 pm",NPPA gets GST ready; releases ceiling price of 761 medicines
"Updated : June 27, 2017, 3:39 pm",GST scare: Fearing losses Chandigarh chemists stop buying stocks
"Updated : June 26, 2017, 5:05 pm",New DNA mini-machines may lead to molecular computers
"Updated : June 22, 2017, 5:15 pm",Mizoram launches scheme for better treatment of HIV-hit people
"Updated : June 19, 2017, 4:35 pm",Asian plant extract may help treat HIV: study
"Updated : June 17, 2017, 12:29 pm",Top of his game
"Updated : June 15, 2017, 7:45 pm",Govt to revise draft amendments to tobacco-control law
"Updated : June 15, 2017, 1:59 pm","1,500 Delhi children missing till May this year- some will never return: Report"
"Updated : June 15, 2017, 10:49 am",Free education upto class 12 for children of HIV positive patients
"Updated : June 12, 2017, 6:34 pm",Transgender appointed as Social Development Officer of KISS
"Updated : June 12, 2017, 3:50 pm","Woman claims to be HIV+, court grants bail in flesh trade case"
"Updated : June 12, 2017, 1:55 pm",Chronic illness may increase risk of suicide: study
"Updated : June 11, 2017, 4:40 pm",KISS appoints a transgender as social development officer
"Updated : June 11, 2017, 3:00 pm",KISS appoints a transgender as social development officer
"Updated : June 11, 2017, 3:00 pm",KISS appoints a transgender as social development officer
"Updated : June 11, 2017, 2:40 pm",KISS appoints a transgender as social development officer
"Updated : June 6, 2017, 1:50 am",Most of myths on children untrue: NCPCR handbook for panchayat
"Updated : June 4, 2017, 2:05 pm",Priyanka Chopras twinning moment with Nicole Kidman
"Updated : June 2, 2017, 6:00 pm",Some vaginal bacteria may render HIV drug ineffective
"Updated : June 2, 2017, 4:15 pm",Tobacco use doubles death risk in HIV patients: study
"Updated : May 31, 2017, 7:15 pm",War on drugs: Punjab govt to team up with United Nations
"Updated : May 30, 2017, 4:40 pm",New low-cost test to detect hidden HIV faster
"Updated : May 29, 2017, 12:35 pm",City doctors talk about how being careless about your period can harm you
"Updated : May 27, 2017, 1:20 pm",Bono visits George W Bush ahead of his concert in Texas
"Updated : May 24, 2017, 6:03 pm","Indonesia deploys new police taskforce to 'target' gays, considers homosexuality national threat"
"Updated : May 23, 2017, 2:50 pm",Sex education: Important for psychological growth or overhyped westernisation?
"Updated : May 23, 2017, 1:19 pm","After iPhone7, OnePlus 5 may also come in Red colour"
"Updated : May 21, 2017, 1:45 pm",Countrys lone cadaveric bone bank a non-starter even after 18
"Updated : May 21, 2017, 9:10 am",Majority of adolescent deaths due to preventable causes: WHO
